user_input,retrieved_contexts,response,reference,faithfulness,answer_relevancy,context_precision
cual es el torque y potencia maxima que tiene la moto,"['CONTAMOS CON EL\nRECORDDEMOTOSVENDIDAS\nOrgullosamente líderes en Colombia. Boxer establece un récord en la industria, con la moto\nmás vendida en la historia de Colombia: la BOXER CT100. Un testimonio de confianza y\nrendimiento que nos impulsa a seguir brindando lo mejor en cada viaje. ¡Únete a la leyenda\ncon una BOXER!\n651.905\nBOXER CT100 VENDIDAS A LA FECHA, DESDE 1998\nCONÓCELA A FONDO\nDETALLESTÉCNICOSDELABOXERCT100KS\nCatálogo 5 Manual 5\nMOTOR\nMOTOR\nMotor: 4 tiempos, Monocilíndrico, SOHC\nBoxer CT100 KS\nCilindraje: 102 cc PRECI\nVER AHORRO\nO Cotizar $\n*Modelo 20S2IS6T. PErMeAcio referencial y\nVIGENTE\n$5.899.\nsuEjLeÉtCo TaR cIaCmObios.\nCotizar $ Crédito $ Máxima p*Aoplticeann técrmiain:o s7 .y59 H0p0 @0 7500 rpm\nCrédito $\ncondiciones.\n\nEN ESPAÑOL\nHome / Bikes / Boxer Ct 100 Ks\nBOXER CT 100 KS\nKNOW MORE\nFunciones\nRendimiento\nPotencia líder en su clase\nMotor de 4 tiempos refrigerado por aire\nnatural\nConduzca con la promesa de la mejor\neficiencia de combustible de su clase de\n55 kmpl*, es decir, aproximadamente\nmás de 500 km con el tanque lleno.\nFiabilidad garantizada\nFiabilidad día tras día, con el músculo\npara conquistar los desafíos y el\nrendimiento para traspasar las fronteras.\n\nTablas:\nBOXER CT 100 KS\nKNOW MORE\nFunciones\nRendimiento\nPotencia líder en su clase\nMotor de 4 tiempos refrigerado por aire\nnatural\nConduzca con la promesa de la mejor\neficiencia de combustible de su clase de\n55 kmpl*, es decir, aproximadamente\nmás de 500 km con el tanque lleno.\nFiabilidad garantizada\nFiabilidad día tras día, con el músculo\npara conquistar los desafíos y el\nrendimiento para traspasar las fronteras.\n\nTablas:\n |  |  |  |  |  |  |  |  |  | \nCILINDRAJE |  |  | 102 CC |  |  |  | 97.2 CC |  |  | \nPOTENCIA |  |  | 7.59 HP 7500 RPM |  | 7.7 | H | P 7500 RPM |  |  | \nTORQUE |  |  | 8.24 NM @5500 RPM | 8 | .2 | NM | @4500 RPM |  |  | \nENCENDIDO |  |  | Pedal |  |  |  | Pedal |  |  | \nCAPACIDAD DEL\nTANQUE |  |  | 10.5 L |  |  |  | 10.5 L |  |  | \nFRENO DELANTERO |  |  | Tambor 110 mm |  |  |  | Tambor |  |  | \nSUSPENSION TRASERA |  |  | Brazo oscilante, Tecnología SNS de 5\nposiciones | Doble amort | ig | ua | dor ajustable |  |  | e\nUSB |  |  | Si |  |  |  | No |  |  | \n*La información técnica e imágenes de referencia de las motocicletas fue\nsitio oficial de cada una de las marcas a la fecha 31/10/2024. |  |  |  |  | to | ma | da del |  |  | \nBoxer CT100 KS\nPRECI\nVER AHORRO\nO Coti\n*Modelo 2026. Precio referencial y\nVIGENTE\n$5.899.\nsujeto a cambios.\nCotizar $ Crédito $ *Aplican términos y 000\nC |  |  |  |  |  |  | $\no $ |  |  | \n |  |  |  |  | za | r |  |  |  |\n\nBOXER CT100 KS\nLAPREFERIDAPORLOSCOLOMBIANOS\nCon más de 639.409 motos vendidas a lo largo de los años es la moto más vendida en la\nhistoria de Colombia, lo que confirma que es preferida por los colombianos, porque es la\nmoto que te da más rendimiento en combustible con 370km/Galón, por su respaldo,\neconomía, fácil mantenimiento, repuestos económicos y disponibles, además con encendido\neléctrico.\nBoxer CT100 KS\nPRECI\nVER AHORRO\nO Cotizar $\n*Modelo 2026. Precio referencial y\nVIGENTE\n$5.899.\nsujeto a cambios.\nCotizar $ Crédito $ *Aplican términos y 000\nCrédito $\ncondiciones.\n\nTablas:\n | \n | \n | \n | \nza | r\n | \nré | dit\n | \n |\n\n102 CC\nCilindraje\n7.59 HP\nPotencia máxima a 7500 RPM\n8.24 NM\nTorque máximo a 5500 RPM\n109 KG\nPeso en seco\nBoxer CT100 KS\nPRECI\nVER AHORRO\nO Cotizar $\n*Modelo 2026. Precio referencial y\nVIGENTE\n$5.899.\nsujeto a cambios.\nCotizar $ Crédito $ *Aplican términos y 000\nCrédito $\ncondiciones.\n\nTablas:\n102 CC\nCilindraje\n7.59 HP\nPotencia máxima a 7500 RPM\n8.24 NM\nTorque máximo a 5500 RPM\n109 KG\nPeso en seco\nBoxer CT100 KS\nPRECI\nVER AHORRO\nO Cotizar $\n*Modelo 2026. Precio referencial y\nVIGENTE\n$5.899.\nsujeto a cambios.\nCotizar $ Crédito $ *Aplican términos y 000\nCrédito $\ncondiciones.']","¡Hola! Con gusto te proporciono la información sobre el torque y la potencia máxima de la Bajaj Boxer CT100 KS:

*   **Potencia máxima:** 7.59 HP a 7500 RPM
*   **Torque máximo:** 8.24 NM a 5500 RPM

Espero que esta información te sea útil. Si tienes alguna otra pregunta, no dudes en consultarme.",Potencia: 7.59 HP a 7.500 RPM. Torque: 8.24 Nm a 5.500 RPM.,0.5,0.5024967667057996,0.0
cada cuanto es recomendable cambiarle el aceite a la moto y cuanto debo echarle,"['continuación se debe enjuagar.\nOTRAS •Se aconseja, sobre todo para condiciones de funcionamiento adversas, proteger la motocicleta con ceras o\nRECOMENDACIONES lubricantes adecuados. Su Concesionario podrá aconsejarle acerca de los mismos.\n•Si va a guardar la motocicleta durante un tiempo, consulte con su Centro de Servicio UMA para las\nrecomendaciones indicadas.\n•Recuerde agendar cita en su Centro de Servicio UMA más cercano para los cambios periódicos de aceite,\nmantenimientos preventivos, generales y demás.\n•Recomendamos utilizar para todas nuestras motocicletas Aceite Genuino BAJAJ (BGO) y realizar el cambio\ncada 5.000 km a 5.500 km o cada tres meses lo que primero ocurra.\n. 45 .\n\ncontinuación se debe enjuagar.\nOTRAS •Se aconseja, sobre todo para condiciones de funcionamiento adversas, proteger la motocicleta con ceras o\nRECOMENDACIONES lubricantes adecuados. Su Concesionario podrá aconsejarle acerca de los mismos.\n•Si va a guardar la motocicleta durante un tiempo, consulte con su Centro de Servicio UMA para las\nrecomendaciones indicadas.\n•Recuerde agendar cita en su Centro de Servicio UMA más cercano para los cambios periódicos de aceite,\nmantenimientos preventivos, generales y demás.\n•Recomendamos utilizar para todas nuestras motocicletas Aceite Genuino BAJAJ (BGO) y realizar el cambio\ncada 5.000 km a 5.500 km o cada tres meses lo que primero ocurra.\n. 45 .\n\nAceite de motor\nEspecificaciones del SAE 20 W 50, / 10 W 30 Asentamiento del motor :\nAceite Recomendado API SL, JASO MA Es importante para prolongar la vida del motor y\nmantenerlo libre de problemas de rendimiento .\nFrecuencia de Cambio Cada 5.000 Km Durante los primeros 2.000 kms no debe\nexceder las siguientes velocidades.\nCambio:1.000 cc\nCapacidad de Aceite\nDesensamble: 1.100 cc\nkm 1ra 2da 3ra 4ta\nFILTRO TAMIZ DE ACEITE (CEDAZO): 0 - 1.000 15 30 45 55 km/h\n1.000 - 2.000 20 40 60 75 km/h\n• Se localiza dentro de la cubierta del embrague.\n• Se debe limpiar periódicamente acudiendo a un\ncentro de servicio autorizado según el cuadro de Mantenga siempre la velocidad por debajo de los\nvalores indicados en la tabla de arriba.\nmantenimiento.\nIMPORTANTE No revolucione el motor excesivamente.\nAntes de encender el motor verifique si el nivel de\naceite 4T es el adecuado. Ver sección: ACEITE MOTOR\nNo ponga en movimiento la motocicleta\nFILTRO DE ACEITE (PAPEL):\n\nAceite de motor\nSAE 20 W 50/ 1 0 W 30 Asentamiento del motor :\nAceite Recomendado API SL, JASO MA Es importante para prolongar la vida del motor y\nmantenerlo libre de problemas de rendimiento .\nFrecuencia de Cambio Cada 5.000 Km Durante los primeros 2.000 kms no debe\nexceder las siguientes velocidades.\nCambio:1.000 cc\nCapacidad de Aceite\nDesensamble: 1.100 cc\nkm 1ra 2da 3ra 4ta\nFILTRO TAMIZ DE ACEITE (CEDAZO): 0 - 1.000 15 30 45 55 km/h\n1.000 - 2.000 20 40 60 75 km/h\n• Se localiza dentro de la cubierta del embrague.\n• Se debe limpiar periódicamente acudiendo a un\ncentro de servicio autorizado según el cuadro de Mantenga siempre la velocidad por debajo de los\nvalores indicados en la tabla de arriba.\nmantenimiento.\nIMPORTANTE No revolucione el motor excesivamente.\nAntes de encender el moto\naceite 4T es el adecuado. Ver sección: ACEITE MOTOR\nNo ponga en movimiento la motocicleta\nFILTRO DE ACEITE (PAPEL):\ninmediatamente después de haber encendido el\n\nCadena - Aceite de Motor\nIMPORTANTE\nAntes de encender el moto\naceite 4T es el adecuado. Ver sección: ACEITE MOTOR\nACEITE DEL MOTOR: Revisar cada semana\n• Mantenga el nivel de aceite entre\nla marca superior y la marca inferior\nde la mirilla.\n• Cambie el aceite como lo indica la\ntabla de mantenimiento periódico.\nCadena: Inspección nivel de aceite :\nEl ajuste de la cadena debe ser realizado siempre que sea 1.\nrequerido (realice constantemente la inspección de esta). nivelada en el estante central.\nC\nLa holgura de la cadena debe estar entre 20 - 30 mm. D 2. Compruebe el nivel de aceite (con el motor apagado)\nLas marcas de los ajustadores de la cadena deben estar en la mirilla como se muestra en la fotografía.\nen la misma posición a ambos lados. 3. Siempre mantenga el nivel de aceite entre\nla marca superior (C) y la marca inferior (D).\nNOTA: El no realizar este proceso o mantener la\nholgura de la cadena fuera de estos límites generará Es muy importante seguir la frecuencia recomendada']","¡Hola! Para tu Bajaj Boxer CT100 KS, te recomiendo lo siguiente:

*   **Frecuencia de cambio de aceite:** Cada 5.000 km a 5.500 km o cada tres meses, lo que ocurra primero.
*   **Cantidad de aceite:**
    *   Cambio: 1.000 cc
    *   Desensamble: 1.100 cc

Además, te recomiendo usar Aceite Genuino BAJAJ (BGO) con especificaciones SAE 20 W 50, API SL, JASO MA. ¡Espero que esto te ayude a mantener tu moto en óptimas condiciones!","Cada 5.000 a 5.500 km o cada 3 meses. Cantidad: 1.000 cc (cambio normal), 1.100 cc (con desensamble).",0.75,0.3219067243849792,0.9999999999
cual es la elongadura recomendada de la cadena y cada cuanto debo cambiar el kit de arrastre,['la marca superior (C) y la marca inferior (D).\nNOTA: El no realizar este proceso o mantener la\nholgura de la cadena fuera de estos límites generará Es muy importante seguir la frecuencia recomendada\nun desgaste acelerado del kit de arrastre. de cambio de aceite para dar una larga vida a los componentes del motor.\nLubrique la cadena por lo menos cada 500 km si usa Para más detalles consulte cuadro de mantenimiento periódico.\nla motocicleta en zonas muy húmedas o polvorientas.\n. 22 .\n\nun desgaste acelerado del kit de arrastre. de cambio de aceite para dar una larga vida a los componentes del motor.\nLubrique la cadena por lo menos cada 500 km si usa Para más detalles consulte cuadro de mantenimiento periódico.\nla motocicleta en zonas muy húmedas o polvorientas.\n. 22 .\n\nCadena - Aceite de Motor\nIMPORTANTE\nAntes de encender el moto\naceite 4T es el adecuado. Ver sección: ACEITE MOTOR\nACEITE DEL MOTOR: Revisar cada semana\n• Mantenga el nivel de aceite entre\nla marca superior y la marca inferior\nde la mirilla.\n• Cambie el aceite como lo indica la\ntabla de mantenimiento periódico.\nCadena: Inspección nivel de aceite :\nEl ajuste de la cadena debe ser realizado siempre que sea 1.\nrequerido (realice constantemente la inspección de esta). nivelada en el estante central.\nC\nLa holgura de la cadena debe estar entre 20 - 30 mm. D 2. Compruebe el nivel de aceite (con el motor apagado)\nLas marcas de los ajustadores de la cadena deben estar en la mirilla como se muestra en la fotografía.\nen la misma posición a ambos lados. 3. Siempre mantenga el nivel de aceite entre\nla marca superior (C) y la marca inferior (D).\nNOTA: El no realizar este proceso o mantener la\nholgura de la cadena fuera de estos límites generará Es muy importante seguir la frecuencia recomendada\n\nCadena - Aceite de Motor\nIMPORTANTE\nAntes de encender el motor verifique si el nivel de\naceite 4T es el adecuado. Ver sección: ACEITE MOTOR\nACEITE DEL MOTOR: Revisar cada semana\n• Mantenga el nivel de aceite entre\nla marca superior y la marca inferior\nde la mirilla.\n• Cambie el aceite como lo indica la\ntabla de mantenimiento periódico.\nCadena: Inspección nivel de aceite :\nEl ajuste de la cadena debe ser realizado siempre que sea 1. Coloque la moto sobre una superficie\nrequerido (realice constantemente la inspección de esta). nivelada en el estante central.\nC\nLa holgura de la cadena debe estar entre 20 - 30 mm. D 2. Compruebe el nivel de aceite (con el motor apagado)\nLas marcas de los ajustadores de la cadena deben estar en la mirilla como se muestra en la fotografía.\nen la misma posición a ambos lados. 3. Siempre mantenga el nivel de aceite entre\nla marca superior (C) y la marca inferior (D).\nNOTA: El no realizar este proceso o mantener la\n\nFRENO DELANTERO FRENO TRASERO\nPara una conducción segura los frenos siempre El freno trasero está correctamente ajustado si:\nse deben mantener en perfecto estado. El freno\nestá correctamente ajustado si: • La rueda gira libremente cuando el pedal de freno está libre.\n• La acción de frenado se inicia después que la palanca del freno\n• La rueda gira libremente cuando la palanca de freno está libre. delantero es presionada por 20 - 30 mm.\n• La acción de frenado se inicia después que la palanca del freno\ndelantero es presionada por 2 - 3 mm.\nAjuste de freno Estas condiciones se obtienen mediante el ajuste de la tuerca reguladora que se muestran en la imagen.\ndelantero\no trasero • Disminuir la holgura de la palanca o pedal: Gire la tuerca reguladora regulador en sentido horario.\n• Aumentar la holgura de la palanca o pedal: Gire la tuerca reguladora en sentido antihorario.\n. 20 .\n\nTablas:'],"¡Hola! Con gusto te ayudo con tu pregunta sobre la cadena de tu Bajaj Boxer CT100 KS:

*   **Elongación recomendada de la cadena:** La holgura de la cadena debe estar entre 20 - 30 mm.
*   **Frecuencia de cambio del kit de arrastre:** No hay una frecuencia específica definida en la información proporcionada. Sin embargo, se indica que no mantener la holgura de la cadena dentro de los límites recomendados generará un desgaste acelerado del kit de arrastre.

Además, te recomiendo lubricar la cadena por lo menos cada 500 km, especialmente si usas la motocicleta en zonas muy húmedas o polvorientas.",Holgura recomendada entre 20 y 30 mm. Lubricar cada 500 km. Cambiar el kit cuando haya desgaste visible.,0.75,0.2131412969202661,0.9999999999
en que parte puedo encontrar la bateria de la moto,"['GARANTÍA EN BATERÍAS: La batería de su motocicleta BAJAJ cuenta con una garantía de 6 meses o 6.000 km, lo primero que\nocurra a partir de la fecha de entrega de su motocicleta.\nCada Centro de Servicio UMA registrará la siguiente información de la batería en la hoja de vida de\nsu motocicleta garantizando así una adecuada trazabilidad y transparencia al cliente en el momento\nde evaluar una solicitud de garantía:\nINFORMACIÓN DE GARANTÍA DE LA BATERÍA\nFecha de Venta\nMarca\nReferencia\nSerial\nTipo de Batería\nPlaca\nVoltaje\n. 54 .\n\nTablas:\nINFORMACIÓN DE GARANTÍA DE LA BATERÍA | \nFecha de Venta | \nMarca | \nReferencia | \nSerial | \nTipo de Batería | \nPlaca | \nVoltaje |\n\nGARANTÍA EN BATERÍAS: La batería de su motocicleta BAJAJ cuenta con una garantía de 6 meses o 6.000 km, lo primero que\nocurra a partir de la fecha de entrega de su motocicleta.\nCada Centro de Servicio UMA registrará la siguiente información de la batería en la hoja de vida de\nsu motocicleta garantizando así una adecuada trazabilidad y transparencia al cliente en el momento\nde evaluar una solicitud de garantía:\nINFORMACIÓN DE GARANTÍA DE LA BATERÍA\nFecha de Venta\nMarca\nReferencia\nSerial\nTipo de Batería\nPlaca\nVoltaje\n. 54 .\n\nTablas:\nINFORMACIÓN DE GARANTÍA DE LA BATERÍA | \nFecha de Venta | \nMarca | \nReferencia | \nSerial | \nTipo de Batería | \nPlaca | \nVoltaje |\n\nUbicación\nEl puerto de carga USB está ubicado en la\nparte superior del tablero de instrumentos.\nUso\nEste puerto de carga USB debe usarse sólo cuando el motor\nesté encendido, de lo contrario se pueden generar fallas\nen el sistema eléctrico por descarga de la batería.\nCuidados\nNo utilice el puerto de carga USB en condiciones de lluvia, pues\nesto puede generar daños irreversibles en el sistema eléctrico de\nla motocicleta. Cuando no esté utilizando el puerto de carga USB\nle recomendamos mantenerlo tapado para evitar acumulación\nde humedad o polvo.\nCuando esté conduciendo su motocicleta, mantenga su mirada\nPRECAUCIÓN\nen la vía, cualquier distracción puede generar un accidente.\n. 16 .\n\nTablas:\n\nPuerto de Carga USB\nUbicación\nEl puerto de carga USB está ubicado en la\nparte superior del tablero de instrumentos.\nUso\nEste puerto de carga USB debe usarse sólo cuando el motor\nesté encendido, de lo contrario se pueden generar fallas\nen el sistema eléctrico por descarga de la batería.\nCuidados\nNo utilice el puerto de carga USB en condiciones de lluvia, pues\nesto puede generar daños irreversibles en el sistema eléctrico de\nla motocicleta. Cuando no esté utilizando el puerto de carga USB\nle recomendamos mantenerlo tapado para evitar acumulación\nde humedad o polvo.\nCuando esté conduciendo su motocicleta, mantenga su mirada\nPRECAUCIÓN\nen la vía, cualquier distracción puede generar un accidente.\n. 16 .\n\nTablas:\n\nBatería Bujía\nLa batería se encuentra ubicada en • Quite la bujía usando la\nel interior de la cubierta izquierda. herramienta adecuada.\nCuide del Medio Ambiente entregando • Limpie la bujía.\nla batería utilizada al centro de • Ajuste la calibración doblando\nservicio UMA para su correcta el electrodo lateral con cuidado.\nREFERENCIA\nCalibración: 0,6 - 0,7 mm\n• Cuando la batería está Bujías : Mico UR 3 AC o\ndescargada, llévela a recargar. Champion PRZ 9 HC\nLLANTAS\nPRECAUCIÓN:\nMantenga la presión adecuada como se menciona\nNo conduzca la moto con la batería desconectada o averiada. Puede\nabajo para aumentar la vida útil de la llanta, garantizar\nprovocar daños en los componentes eléctricos / electrónicos.\nla seguridad durante la conducción y para un mejor\nconsumo de combustible.\nKit de herramientas:\n• Está ubicado al lado de la batería.\nDelantera 25 psi\n• Sujete bien el kit de herramientas con la\nbanda elástica para evitar que se caiga. Trasera Sólo 28 psi']","¡Hola! En tu Bajaj Boxer CT100 KS, la batería se encuentra ubicada en el interior de la cubierta izquierda.",Está ubicada en el interior de la cubierta lateral izquierda.,1.0,0.30716775691730097,0.9999999999
en que parte puedo encontrar el serial del chasis y el del motor de la moto,"['Identificación de Los números de Motor y de VIN (Chasis) se utilizan para registrar e identificar la motocicleta\nla Motocicleta su motocicleta BAJAJ CT-100 KS particular de otros del mismo modelo y el tipo.\nEl número de VIN se ubica en la parte frontal derecha El número de Motor se ubica en la parte inferior del motor\ndel chasis, justo en frente del tanque de combustible del lado izquierdo, justo debajo de la palanca de cambios.\n. 13 .\n\nTablas:\n\nIdentificación de\nla Motocicleta su motocicleta BAJAJ CT-100 ES particular de otros del mismo modelo y el tipo.\nEl número de VIN se ubica en la parte frontal derecha El número de Motor se ubica en la parte inferior del motor\ndel chasis, justo en frente del tanque de combustible del lado izquierdo, justo debajo de la palanca de cambios.\n. 13 .\n\nTablas:\n\nIDENTIFICACIÓN DE\nLA MOTOCICLETA\n\nTablas:\n\nIDENTIFICACIÓN DE\nLA MOTOCICLETA\n\nTablas:\n\n¡BIENVENIDO!\nFELICIDADES por haber elegido una motocicleta “BAJAJ CT - En caso de necesitar cualquier información adicional, por favor\n100 ES”, una de las mejores motocicletas del país presentada acérquese al personal de Bajaj. Si es necesario, también puede\na usted por Bajaj Auto Limited y Grupo UMA S.A.S escribir a los distribuidores que vendan nuestros productos, para\nobtener información de número de chasis, número de motor,\nAntes de prepararse para conducir su moto, por favor lea esta fecha de compra, distancia requerida en cada servicio, nombre del\nguía del usuario para familiarizarse con el mecanismo y los concesionario de venta y sus números de contacto. Por último, le\nmandos del vehículo. solicitamos llevar su motocicleta con el cuidado y mantenimiento\nperiódico, como se describe en este manual.\nPara mantener su motocicleta en perfecto estado de\nfuncionamiento y para ofrecer un rendimiento consistente, le Estamos seguros que esta le ofrecerá una experiencia placentera']","¡Hola! Con gusto te indico dónde encontrar el serial del chasis (VIN) y el número del motor en tu Bajaj Boxer CT100 KS:

*   **Número de VIN (Chasis):** Se ubica en la parte frontal derecha del chasis, justo en frente del tanque de combustible.
*   **Número de Motor:** Se encuentra en la parte inferior del motor, del lado izquierdo, justo debajo de la palanca de cambios.

Estos números son importantes para registrar e identificar tu motocicleta. ¡Espero que esta información te sea útil!","VIN: parte frontal derecha del chasis. Motor: parte inferior izquierda, debajo de la palanca de cambios.",1.0,0.48715451147102923,0.9999999999
cuanta gasolina le cabe a la moto,"['Grifo de combustible\ndesde el tanque hasta el carburador, este tiene 3 posiciones.\nON:\ncantidad sea mayor a 1,2 litros, cuando la cantidad sea\nmenor a la mencionada la motocicleta se apagará.\nTapa del tanque de combustible\nPara abrir la tapa del depósito de combustible, inserte\nRES:\nla llave en la cerradura y gírela hacia la derecha y\nes menor a 1,2 litros, debe abastecer combustible lo\nlevante la tapa del tanque de combustible.\nantes posible.\nLa tapa se cierra empujándola hacia abajo.\nOFF:\n. 17 .\n\nTablas:\n\nTanque de Combustible\nGrifo de combustible\nEl grifo de combustible se encarga de controlar el flujo de combustible\ndesde el tanque hasta el carburador, este tiene 3 posiciones.\nON: Permite el flujo de combustible siempre que la\ncantidad sea mayor a 1,2 litros, cuando la cantidad sea\nmenor a la mencionada la motocicleta se apagará.\nTapa del tanque de combustible\nPara abrir la tapa del depósito de combustible, inserte\nla llave en la cerradura y gírela hacia la derecha y RES: Permite el flujo de combustible cuando la cantidad\nlevante la tapa del tanque de combustible. es menor a 1,2 litros, debe abastecer combustible lo\nantes posible.\nLa tapa se cierra empujándola hacia abajo.\nOFF: Restringe el flujo de combustible.\n. 17 .\n\nTablas:\n\nAceite de Motor\n• p. 56\n• ¿Cómo Conducir tu Motocicleta? p. 24\n• p. 57\n• P. 26\n• p. 58\n• p. 30\n• p. 58\n• Almacenamiento de la Motocicleta ............................................ p. 34\n\nAlmacenamiento de la Motocicleta\nEste procedimiento debe llevarse a cabo antes de Preparación para el uso después del\nguardar la motocicleta por más de 15 días para evitar almacenamiento\nque la motocicleta se oxide y pueda sufrir otros daños\nno operacionales como los riesgos de incendio. 1. Limpie la moto\n2. Asegúrese que la bujía está bien apretada.\n1. Limpie la motocicleta a fondo. 3. Llene el depósito de combustible.\n2. Vacíe el combustible del tanque y la cuba del del 4. Cambie el aceite del motor.\ncarburador (si el combustible se deja durante un 5. Compruebe todos los puntos enumerados en la\ntiempo más largo, el combustible dañará los sección de los controles de seguridad diaria.\nempaques internos del carburador). 6. Controle e infle las llantas con la\n3. Retire la bujía y agregue alrededor de presión adecuada.\n3 ml de aceite de motor en el cilindro.\n4. Accione el pedal de arranque unas cuantas Para la Batería:\nveces para cubrir la pared del cilindro con el\n\nAlmacenamiento de la Motocicleta\nEste procedimiento debe llevarse a cabo antes de Preparación para el uso después del\nguardar la motocicleta por más de 15 días para evitar almacenamiento\nque la motocicleta se oxide y pueda sufrir otros daños\nno operacionales como los riesgos de incendio. 1. Limpie la moto\n2. Asegúrese que la bujía está bien apretada.\n1. Limpie la motocicleta a fondo. 3. Llene el depósito de combustible.\n2. Vacíe el combustible del tanque y la cuba del del 4. Cambie el aceite del motor.\ncarburador (si el combustible se deja durante un 5. Compruebe todos los puntos enumerados en la\ntiempo más largo, el combustible dañará los sección de los controles de seguridad diaria.\nempaques internos del carburador).\n3. Retire la bujía y agregue alrededor de presión adecuada.\n3 ml de aceite de motor en el cilindro.\n4. Accione el pedal de arranque unas cuantas Para la Batería:\nveces para cubrir la pared del cilindro con el']","¡Hola! Lamentablemente, no tengo la información específica sobre la capacidad del tanque de gasolina de la Bajaj Boxer CT100 KS en los documentos que me has proporcionado.",Capacidad total: 10.5 litros. Reserva: 2.3 litros.,0.5,0.0,0.0
en donde se encuentra la llave de gasolina de la moto,"['Grifo de combustible\ndesde el tanque hasta el carburador, este tiene 3 posiciones.\nON:\ncantidad sea mayor a 1,2 litros, cuando la cantidad sea\nmenor a la mencionada la motocicleta se apagará.\nTapa del tanque de combustible\nPara abrir la tapa del depósito de combustible, inserte\nRES:\nla llave en la cerradura y gírela hacia la derecha y\nes menor a 1,2 litros, debe abastecer combustible lo\nlevante la tapa del tanque de combustible.\nantes posible.\nLa tapa se cierra empujándola hacia abajo.\nOFF:\n. 17 .\n\nTablas:\n\ndirección hacia la derecha o izquierda.\nF. Interruptor de encendido: Al girar la llave\nse activa o desactiva el sistema eléctrico\nLa llave de la motocicleta funciona para el interruptor de encendido, tapa del\ny encendido y se bloquea la direccion.\ntanque de combustible y cierre de la cubierta lateral izquierda.\nG. Odómetro: Muestra la distancia total recorrida.\n. 15 .\n\ndirección hacia la derecha o izquierda.\nF. Interruptor de Encendido: Al girar la llave\nse activa o desactiva el sistema eléctrico\nLa llave de la motocicleta funciona para el interruptor de encendido, tapa del\ny encendido y se bloquea la direccion.\nG. Odómetro: Muestra la distancia total recorrida. tanque de combustible y cierre de la cubierta lateral izquierda.\n. 15 .\n\nTanque de Combustible\nGrifo de combustible\nEl grifo de combustible se encarga de controlar el flujo de combustible\ndesde el tanque hasta el carburador, este tiene 3 posiciones.\nON: Permite el flujo de combustible siempre que la\ncantidad sea mayor a 1,2 litros, cuando la cantidad sea\nmenor a la mencionada la motocicleta se apagará.\nTapa del tanque de combustible\nPara abrir la tapa del depósito de combustible, inserte\nla llave en la cerradura y gírela hacia la derecha y RES: Permite el flujo de combustible cuando la cantidad\nlevante la tapa del tanque de combustible. es menor a 1,2 litros, debe abastecer combustible lo\nantes posible.\nLa tapa se cierra empujándola hacia abajo.\nOFF: Restringe el flujo de combustible.\n. 17 .\n\nTablas:\n\n¿Cómo Conducir tu Motocicleta?\nEncendido del motor: Arranque:\n1. Coloque la llave de gasolina en ON o RES. • Confirme que el estante lateral y central están arriba.\n2. Coloque el interruptor de encendido en posición • Oprima la palanca del embrague.\nON usando la llave de la motocicleta. • Engrane la primera marcha (1a Vel).\n3. Confirme que la transmisión esta en neutral. • Gire levemente el acelerador mientras\n4. Use el ahogador durante el primer encendido o libera simultáneamente el embrague.\ndurante las mañanas frías. La palanca del ahogador • Mientras libera la palanca del embrague abra el acelerador,\n/choke se localiza en la parte izquierda del carburador. solo para alcanzar las r.p.m necesarias para mover la moto.\n5. Mantenga el acelerador cerrado, accione\nel pedal de arranque con el pie. Cambio de marchas:\n6. Cuando el motor se haya calentado lo suficiente, • Libere el acelerador y oprima la palanca del embrague']","¡Hola! La llave de gasolina de tu Bajaj Boxer CT100 KS no es una llave física, sino más bien una llave de paso o grifo de combustible. Este grifo tiene tres posiciones:

*   **ON:** Permite el flujo de combustible siempre que la cantidad en el tanque sea mayor a 1,2 litros. Si baja de este nivel, la moto se apagará.
*   **RES (Reserva):** Permite el flujo de combustible cuando la cantidad es menor a 1,2 litros. En esta posición, debes buscar abastecer combustible lo antes posible.
*   **OFF:** Restringe completamente el flujo de combustible.

Este grifo se encarga de controlar el flujo de combustible desde el tanque hasta el carburador.","Está en el lateral del motor. Posiciones: ON, RES y OFF.",0.0,0.2904301579483281,0.9999999999
cuales son las especificaciones de la bateria ,"['GARANTÍA EN BATERÍAS: La batería de su motocicleta BAJAJ cuenta con una garantía de 6 meses o 6.000 km, lo primero que\nocurra a partir de la fecha de entrega de su motocicleta.\nCada Centro de Servicio UMA registrará la siguiente información de la batería en la hoja de vida de\nsu motocicleta garantizando así una adecuada trazabilidad y transparencia al cliente en el momento\nde evaluar una solicitud de garantía:\nINFORMACIÓN DE GARANTÍA DE LA BATERÍA\nFecha de Venta\nMarca\nReferencia\nSerial\nTipo de Batería\nPlaca\nVoltaje\n. 54 .\n\nTablas:\nINFORMACIÓN DE GARANTÍA DE LA BATERÍA | \nFecha de Venta | \nMarca | \nReferencia | \nSerial | \nTipo de Batería | \nPlaca | \nVoltaje |\n\nGARANTÍA EN BATERÍAS: La batería de su motocicleta BAJAJ cuenta con una garantía de 6 meses o 6.000 km, lo primero que\nocurra a partir de la fecha de entrega de su motocicleta.\nCada Centro de Servicio UMA registrará la siguiente información de la batería en la hoja de vida de\nsu motocicleta garantizando así una adecuada trazabilidad y transparencia al cliente en el momento\nde evaluar una solicitud de garantía:\nINFORMACIÓN DE GARANTÍA DE LA BATERÍA\nFecha de Venta\nMarca\nReferencia\nSerial\nTipo de Batería\nPlaca\nVoltaje\n. 54 .\n\nTablas:\nINFORMACIÓN DE GARANTÍA DE LA BATERÍA | \nFecha de Venta | \nMarca | \nReferencia | \nSerial | \nTipo de Batería | \nPlaca | \nVoltaje |\n\n¿QUÉ ES LA\nGARANTÍA?\n\nTablas:\n\nMANUAL DE USUARIO MANUAL DE GARANTÍA\n• Información de seguridad ........................................................... p. 6 • ¿Qué es la garantía? ...................................................................... p. 38\n• Especificaciones técnicas ..……………………………......................... p. 10 • Objetivo de este manual .............................................................. p. 39\n• Identificación de la Motocicleta ..………………….…….………........... p. 12 • Preguntas frecuentes ……………..…………………….......................... p. 41\nUbicación de las Partes\n• Validez de la garantía y condiciones ……..………....................... p. 42\nTablero de Instrumentos e Interruptor de Encendido\n• ¿Qué no cubre la Garantía BAJAJ? ….…………......................….. p. 43\nPuerto de carga USB\nTanque de Combustible • Otras recomendaciones ............................................................... p. 45\nInterruptores Derecho e Izquierdo\n\nESPECIFICACIONES\nTÉCNICAS\n\nTablas:']","¡Hola!

Según la información de garantía de la batería que tengo, cada Centro de Servicio UMA registra la siguiente información en la hoja de vida de tu Bajaj Boxer CT100 KS:

*   Fecha de Venta
*   Marca
*   Referencia
*   Serial
*   Tipo de Batería
*   Placa
*   Voltaje

Además, la batería de tu motocicleta BAJAJ cuenta con una garantía de 6 meses o 6.000 km, lo primero que ocurra a partir de la fecha de entrega.","12V, 3Ah, tipo MF (libre de mantenimiento).",1.0,0.19144309191292866,0.0
cuantas marchas tiene la moto,"['Aceite de Motor\n• p. 56\n• ¿Cómo Conducir tu Motocicleta? p. 24\n• p. 57\n• P. 26\n• p. 58\n• p. 30\n• p. 58\n• Almacenamiento de la Motocicleta ............................................ p. 34\n\ndiferentes velocidades, clima, gasolina, etc.), puede generar distintos sonidos y/o vibraciones, las cuales\nson característicos de cada modelo y no constituyen indicios de ningún problema en la motocicleta. Estos\nsonidos y vibraciones, incluso pueden variar entre motocicletas del mismo modelo y están dados por las\ndiferencias en las tolerancias, ajustes de fabricación, movimiento o fricciones propias de los componentes.\n. 50 .\n\nOTRAS •\nRECOMENDACIONES\n• Las inspecciones periódicas se determinan por kilometraje o tiempo transcurrido (lo que ocurra\ndecisivamente en la conservación del vehículo y son exigidas durante el período de garantía para la\naprobación de la misma. Realizar preventivamente el mantenimiento a su vehículo le permitirá ahorrar\ndinero (Ver imagen en la siguiente página).\n• En caso de presentarse una falla dentro del período de garantía, consulte con su Centro de Servicio UMA\nmás cercano de forma inmediata.\n• SONIDOS Y VIBRACIONES EN LAS MOTOCICLETAS\nEl funcionamiento normal de la motocicleta, bajo distintas formas de conducción (con carga, sin carga,\ndiferentes velocidades, clima, gasolina, etc.), puede generar distintos sonidos y/o vibraciones, las cuales\nson característicos de cada modelo y no constituyen indicios de ningún problema en la motocicleta. Estos\nsonidos y vibraciones, incluso pueden variar entre motocicletas del mismo modelo y están dados por las\n\nEl mantenimiento periódico es una labor muy importante que debe\nMantenimiento Periódico\nrealizarse para mantener en óptimas condiciones de funcionamiento\nla motocicleta, además garantiza su seguridad al conducirla.\nFRECUENCIA RECOMENDADA\nRev 1ra 2da 3ra 4ta 5ta 6ta 7ma 8va 9na 10ma 11va En\nadelante\ncada\n500 5.000 10.000 15.000 20.000 25.000 30.000 35.000 40.000 45.000 50.000\nK/m - - - - - - - - - - - 5.000\n-\nItem Operación 750 5.500 10.500 15.500 20.500 25.500 30.500 35.500 40.500 45.500 50.500 5.500 km Notas\n1 Lavado o o o o o o o o o o o o\n2 Carburador / Ralenti C, A C, A C, A CL, A C, A C, A CL, A C, A C, A CL, A C, A C, A\n3 Aceite R R R R R R R R R R R R\n4 Filtro de Aceite R R R R R R R R R R R R\n5 Filtro Tamiz (CEDAZO) CL CL CL CL CL CL CL CL CL CL CL CL\n6 Bujía C, A C, A C, A R C, A C, A R C, A C, A R C, A C, A\n7 Filtro de Aire C L C L C L R C L C L R C L C L R C L C L Cambiar si\nes necesario\n8 Filtro de Combustible C C C C C C C C C C C C\n9 Manguera de C C C C C R C C C C R R\n\nCOMO CONDUCIR\nTU MOTOCICLETA\n\nTablas:']","¡Hola!

Lamentablemente, no tengo la información específica sobre la cantidad de marchas que tiene la Bajaj Boxer CT100 KS en los documentos que me has proporcionado.",Tiene 4 velocidades.,0.0,0.0,0.0
cada cuanto debo realizarle un mantenimiento preventivo o uno correctivo,"['PREGUNTAS FRECUENTES\n¿Porqué son importantes • Son los que garantizan la calidad, seguridad e idoneidad de la motocicleta. En esos\nlas revisiones de mantenimientos realizamos ajustes a diferentes sistemas de la motocicleta y además\nmantenimiento preventivo? recomendamos el cambio de algunas partes debido al desgaste normal por el uso\nfrecuente, el cambio de estas no corresponden a fallas en la motocicleta, por el\nPara resumir son dos los factores que\ncontrario se realizan con el fin de mantenerla en perfecto estado de funcionamiento.\nhacen que los mantenimiento preventivos\nsean de gran importancia:\n• Son necesarias para mantener tu derecho de acceder a la garantía de 12 meses o\n20.000 kilómetros, lo que primero ocurra, dado que dentro de los exclusiones de\nla garantía encontrarás que un factor excluyente es el NO realizar un adecuado\nmantenimiento del vehículo dentro de los Centros de Servicio UMA.\n. 37 .\n\nTablas:\n\nPREGUNTAS FRECUENTES\n¿Porqué son importantes • Son los que garantizan la calidad, seguridad e idoneidad de la motocicleta. En esos\nlas revisiones de mantenimientos realizamos ajustes a diferentes sistemas de la motocicleta y además\nmantenimiento preventivo? recomendamos el cambio de algunas partes debido al desgaste normal por el uso\nfrecuente, el cambio de estas no corresponden a fallas en la motocicleta, por el\nPara resumir son dos los factores que\nhacen que los mantenimiento preventivos\nsean de gran importancia:\n• Son necesarias para mantener tu derecho de acceder a la garantía de 12 meses o\n20.000 kilómetros, lo que primero ocurra, dado que dentro de los exclusiones de\nla garantía encontrarás que un factor excluyente es el NO realizar un adecuado\nmantenimiento del vehículo dentro de los Centros de Servicio UMA.\n. 37 .\n\nTablas:\n\nInsumos y\nServicio Mano de Obra\nRepuestos\nRevisión de 500 - 750 km - Primeros 15 a 30 días Gratuita\nPara ayudarte a cumplir\nRevisión de 5.000 - 5.500 km o al tercer mes Gratuita\ncon esto Bajaj como\nRevisión de 10.000 - 10.500 km o al sexto mes Gratuita\ncortesía te otorga la Mano\nde Obra Gratuita en las Revisión de 15.000 - 15.500 km o al noveno mes Paga el cliente\nsiguientes revisiones: Revisión de 20.000- 20.500 km o al doceavo mes Paga el cliente Paga el Cliente\nRevisión de 25.000 - 25.500 km o al quinceavo mes Paga el cliente\nRevisión de 30.000 - 30.500 km o al dieciochoavo mes Paga el cliente\nRevisión de 35.000 - 35.500 km o al veintiunavo mes Paga el cliente\nRevisión de 40.000 - 40.500 km o al veinticuatroavo mes Paga el cliente\nLas revisiones de garantía se deben realizar dentro de los tiempos estipulados en este\nNOTA\nmanual, asistir fuera del tiempo ocasiona la pérdida de la garantía y el cobro de la mano\n\nInsumos y\nServicio Mano de Obra\nRepuestos\nRevisión de 500 - 750 km - Primeros 15 a 30 días Gratuita\nPara ayudarte a cumplir\nRevisión de 5.000 - 5.500 km o al tercer mes Gratuita\ncon esto Bajaj como\nRevisión de 10.000 - 10.500 km o al sexto mes Gratuita\ncortesía te otorga la Mano\nde Obra Gratuita en las Revisión de 15.000 - 15.500 km o al noveno mes Paga el cliente\nsiguientes revisiones: Revisión de 20.000- 20.500 km o al doceavo mes Paga el cliente Paga el Cliente\nRevisión de 25.000 - 25.500 km o al quinceavo mes Paga el cliente\nRevisión de 30.000 - 30.500 km o al dieciochoavo mes Paga el cliente\nRevisión de 35.000 - 35.500 km o al veintiunavo mes Paga el cliente\nRevisión de 40.000 - 40.500 km o al veinticuatroavo mes Paga el cliente\nLas revisiones de garantía se deben realizar dentro de los tiempos estipulados en este\nNOTA\nmanual, asistir fuera del tiempo ocasiona la pérdida de la garantía y el cobro de la mano\n\nRealizar el mantenimiento preventivo recomendado en\nlos Centros de Servicio UMA te permite ahorrar dinero\n500 5.000 10.000 15.000 2200..000000 25.000 30.000 35.000 40.000 45.000 50.000 55.000 60.000\n. 51 .\n\nTablas:']","¡Hola!

Para tu Bajaj Boxer CT100 KS, te recomiendo realizar los mantenimientos preventivos según el siguiente esquema:

*   **Revisión inicial:** 500 - 750 km (primeros 15 a 30 días)
*   **Revisión periódica:** Cada 5.000 - 5.500 km o cada tres meses.

Es importante realizar estas revisiones en los Centros de Servicio UMA dentro de los tiempos estipulados para mantener la garantía de tu moto. Recuerda que la mano de obra es gratuita en las revisiones de 500, 5.000 y 10.000 km.",Preventivo cada 5.000 km. Correctivo depende del desgaste. Es recomendable hacerlo en centros UMA.,1.0,0.10997052340932563,0.9999999999
que tan alta es la moto,"['ACEITE DE MOTOR\nVerificación diaria del nivel de aceite\nMantenga siempre el nivel de aceite entre los niveles bajo y alto,\ncuando el nivel de aceite esté llegando al nivel bajo (D), indicado\nen la imagen, debe proceder a completar hasta el nivel máximo (C)\ncon aceite recomendado, sin sobrepasar el nivel máximo. A\n1. Estacione la motocicleta en una superficie plana\nB\n2. Extraiga el tapón medidor de aceite y límpielo.\nC\n3. Inserte tapón medidor hasta el punto R sin roscar. D\n4. Retire de nuevo el tapón y verifique que el nivel de\naceite esté entre las marcas C Y D.\n5. Adicione aceite de ser necesario.\nA. Tapón de aceite\nNo realizar esta operación puede conllevar a\nB. Visor medidor de nivel de aceite\ndaños en componentes internos del motor.\nC. Nivel superior\nRealice el cambio de aceite cada 5.000 km.\nD. Nivel inferior\nPara medir el nivel de aceite, ubique el vehículo en una\nsuperficie plana apoyada sobre un soporte vertical, para este\n\nANTES DE Asegúrese de que se encuentra física y mentalmente apto para conducir su motocicleta,\nCONDUCIR sin haber consumido alcohol ni drogas. Compruebe que tanto usted como su pasajero\nutilizan cascos para motocicletas y elementos protectores debidamente homologados por\nlas normativas locales. Indique al pasajero que se agarre a la correa del asiento o a su\ncintura, que se incline con usted en las curvas y que mantenga los pies en los reposapiés,\nincluso cuando usted se detenga.\nCONOZCA Y DOMINE Aunque haya conducido otras motocicletas, le recomendamos que practique primero en\nSU MOTOCICLETA una zona segura para familiarizarse con el comportamiento y la conducción de su nueva\nmotocicleta, y acostumbrarse a su peso, respuesta del motor y tamaño.\nHÁGASE VISIBLE Especialmente en la noche o cuando la visibilidad sea reducida por las condiciones\nEN LA VÍA climáticas, recuerde usar ropa reflectiva, ubicarse de tal forma que los demás conductores\n\nCadena - Aceite de Motor\nIMPORTANTE\nAntes de encender el moto\naceite 4T es el adecuado. Ver sección: ACEITE MOTOR\nACEITE DEL MOTOR: Revisar cada semana\n• Mantenga el nivel de aceite entre\nla marca superior y la marca inferior\nde la mirilla.\n• Cambie el aceite como lo indica la\ntabla de mantenimiento periódico.\nCadena: Inspección nivel de aceite :\nEl ajuste de la cadena debe ser realizado siempre que sea 1.\nrequerido (realice constantemente la inspección de esta). nivelada en el estante central.\nC\nLa holgura de la cadena debe estar entre 20 - 30 mm. D 2. Compruebe el nivel de aceite (con el motor apagado)\nLas marcas de los ajustadores de la cadena deben estar en la mirilla como se muestra en la fotografía.\nen la misma posición a ambos lados. 3. Siempre mantenga el nivel de aceite entre\nla marca superior (C) y la marca inferior (D).\nNOTA: El no realizar este proceso o mantener la\nholgura de la cadena fuera de estos límites generará Es muy importante seguir la frecuencia recomendada\n\nANTES DE Asegúrese de que se encuentra física y mentalmente apto para conducir su motocicleta,\nCONDUCIR sin haber consumido alcohol ni drogas. Compruebe que tanto usted como su pasajero\nutilizan cascos para motocicletas y elementos protectores debidamente homologados por\nlas normativas locales. Indique al pasajero que se agarre a la correa del asiento o a su\ncintura, que se incline con usted en las curvas y que mantenga los pies en los reposapiés,\nincluso cuando usted se detenga.\nCONOZCA Y DOMINE Aunque haya conducido otras motocicletas, le recomendamos que practique primero en\nSU MOTOCICLETA una zona segura para familiarizarse con el comportamiento y la conducción de su nueva\nmotocicleta, y acostumbrarse a su peso, respuesta del motor y tamaño.\nHÁGASE VISIBLE Especialmente en la noche o cuando la visibilidad sea reducida por las condiciones\nEN LA VÍA\nle vean, usar los direccionales correctamente antes de girar o cambiar de carril y utilizar\nla bocina si fuera necesario.\n\nCOMO CONDUCIR\nTU MOTOCICLETA\n\nTablas:']","¡Hola!

Lamentablemente, no tengo la información específica sobre la altura de la Bajaj Boxer CT100 KS en los documentos que me has proporcionado.",Altura total: 1.072 mm.,0.0,0.0,0.0
cual es la altura del asiento con respecto al piso,"['¿QUÉ ES LA\nGARANTÍA?\n\nTablas:\n\nNombre *\nNombres Apellidos\nNúmero de Cédula * Celular *\n0000000000\nEmail *\n¿Qué moto tienes?\nEscoge tu ubicación actual *\nDepartamento\nCiudad\nHe leído y he aceptado la Autorización para el Tratamiento de\nPersonales. *\nPara conocer nuestro aviso de privacidad da clic en el siguiente link Avi\nPrivacidad Grupo UMA |  |  |  | s\n |  |  |  |  |  | \n |  |  | Apellidos |  |  | \n |  |  |  |  |  | \n |  |  |  |  |  | \n |  |  |  |  |  | \n |  |  |  |  |  | \n |  |  |  | Da | to | \n |  |  |  | so | de | \n |  |  |  |  |  | \n |  | Enviar |  |  |  | \n |  |  |  |  |  | \n |  |  |  |  |  | \n |  |  |  | za | r | \n |  |  |  |  |  | \n |  |  |  | ré | dit | \n |  |  |  |  |  | \n |  |  |  |  |  |\n\nANTES DE Asegúrese de que se encuentra física y mentalmente apto para conducir su motocicleta,\nCONDUCIR sin haber consumido alcohol ni drogas. Compruebe que tanto usted como su pasajero\nutilizan cascos para motocicletas y elementos protectores debidamente homologados por\nlas normativas locales. Indique al pasajero que se agarre a la correa del asiento o a su\ncintura, que se incline con usted en las curvas y que mantenga los pies en los reposapiés,\nincluso cuando usted se detenga.\nCONOZCA Y DOMINE Aunque haya conducido otras motocicletas, le recomendamos que practique primero en\nSU MOTOCICLETA una zona segura para familiarizarse con el comportamiento y la conducción de su nueva\nmotocicleta, y acostumbrarse a su peso, respuesta del motor y tamaño.\nHÁGASE VISIBLE Especialmente en la noche o cuando la visibilidad sea reducida por las condiciones\nEN LA VÍA climáticas, recuerde usar ropa reflectiva, ubicarse de tal forma que los demás conductores\n\nAceite de Motor\n• p. 56\n• ¿Cómo Conducir tu Motocicleta? p. 24\n• p. 57\n• P. 26\n• p. 58\n• p. 30\n• p. 58\n• Almacenamiento de la Motocicleta ............................................ p. 34\n\nsuperficie plana apoyada sobre un soporte vertical, para este\nprocedimiento, tenga en cuenta que el motor debe estar frío.\n. 47 .']","¡Hola!

Lamentablemente, no tengo la información específica sobre la altura de la Bajaj Boxer CT100 KS en los documentos que me has proporcionado.",Altura del asiento: 784 mm.,0.0,0.0,0.0
cual es la presión de las llantas,"['banda elástica para evitar que se caiga. Trasera Sólo 28 psi\n• Puede ser utilizado para guardar un Trasera con Pasajero 32 psi\nkit de primeros auxilios.\nRecuerde verificar el indicador de desgaste\nde las llantas, este le informa si la llanta es\napta o no para la conducción.\n. 21 .\n\nbanda elástica para evitar que se caiga. Trasera Sólo 28 psi\n• Puede ser utilizado para guardar un Trasera con Pasajero 32 psi\nkit de primeros auxilios.\nde las llantas, este le informa si la llanta es\napta o no para la conducción.\n. 21 .\n\n• Salga temprano para llegar a su destino pastillas de freno.\nde manera segura. • Revise la tensión de la cadena de 20 a 30 mm y\n• Lleve siempre los documentos de la motocicleta que esté bien lubricada.\nvigentes y una licencia válida de conducción. • Funcionamiento de todas las luces y bocina.\n• Evite manejar sobre arena suelta o piedras, • Movimiento suave de la dirección sin restricciones.\ndonde el vehículo podría patinar. • Juego libre en la palanca de embrague de 2 a 3 mm.\n• Sujete adecuadamente la ropa suelta mientras • Regreso del estante central y lateral.\nconduce o monta para evitar enredos u otros • Presión de inflado correcta en las dos llantas - sin\nobjetos en las ruedas. grietas/ cortes.\n• Concéntrese siempre en un manejo seguro. • Correcta fijación y posición de los espejos.\n. 28 .\n\nIDENTIFICACIÓN DE\nLA MOTOCICLETA\n\nTablas:\n\nIDENTIFICACIÓN DE\nLA MOTOCICLETA\n\nTablas:']","¡Hola! Con gusto te ayudo con la presión de las llantas de tu Bajaj Boxer CT100 KS:

*   **Trasera (Solo):** 28 psi
*   **Trasera (Con pasajero):** 32 psi

Recuerda verificar regularmente la presión y el estado de tus llantas, incluyendo el indicador de desgaste, para asegurar una conducción segura. ¡Que tengas un buen viaje!",Delantera: 25 PSI. Trasera sin pasajero: 28 PSI. Trasera con pasajero: 32 PSI.,0.75,0.05396814549777836,0.0
que tipos de frenos tiene la moto ,"['Tips para una conducción segura\nFrenada : Estacionando la moto :\n• Libere el acelerador y la palanca de embrague con 1. Coloque la moto en el parador central en una\nla transmisión embragada para que el freno motor\nle ayude a disminuir la velocidad. 2. Bloquee la dirección.\n• Haga los cambios descendentes de marcha uno\na uno para alcanzar la posición neutral cuando PRECAUCIÓN: No intente estacionar la\nse detenga completamente.\n• Aplique ambos frenos (delantero y trasero) inclinadas ya que la motocicleta se podría caer.\nsimultáneamente hasta detenerse por completo.\n• Nunca bloquee los frenos, o de lo contrario hará Tips para una conducción segura:\npatinar las ruedas. En las curvas, utilice los frenos • Siempre use casco mientras conduce la\nde forma juiciosa y no desembrague. motocicleta. Su casco debe ser homologado por\n• Reduzca la velocidad antes de llegar a la curva. las normas locales.\n• En caso de frenada de emergencia concéntrese en • Lea las instrucciones a fondo en este manual y\n\ndiferentes velocidades, clima, gasolina, etc.), puede generar distintos sonidos y/o vibraciones, las cuales\nson característicos de cada modelo y no constituyen indicios de ningún problema en la motocicleta. Estos\nsonidos y vibraciones, incluso pueden variar entre motocicletas del mismo modelo y están dados por las\ndiferencias en las tolerancias, ajustes de fabricación, movimiento o fricciones propias de los componentes.\n. 50 .\n\nTips para una conducción segura\nFrenada : Estacionando la moto :\n• Libere el acelerador y la palanca de embrague con 1. Coloque la moto en el parador central en una\nla transmisión embragada para que el freno motor superficie horizontal.\nle ayude a disminuir la velocidad. 2. Bloquee la dirección.\n• Haga los cambios descendentes de marcha uno\na uno para alcanzar la posición neutral cuando PRECAUCIÓN: No intente estacionar la\nse detenga completamente. motocicleta en el estante central en superficies\n• Aplique ambos frenos (delantero y trasero) inclinadas ya que la motocicleta se podría caer.\nsimultáneamente hasta detenerse por completo.\n• Nunca bloquee los frenos, o de lo contrario hará Tips para una conducción segura:\npatinar las ruedas. En las curvas, utilice los frenos • Siempre use casco mientras conduce la\nde forma juiciosa y no desembrague. motocicleta. Su casco debe ser homologado por\n• Reduzca la velocidad antes de llegar a la curva. las normas locales.\n\n• Salga temprano para llegar a su destino pastillas de freno.\nde manera segura. • Revise la tensión de la cadena de 20 a 30 mm y\n• Lleve siempre los documentos de la motocicleta que esté bien lubricada.\nvigentes y una licencia válida de conducción. • Funcionamiento de todas las luces y bocina.\n• Evite manejar sobre arena suelta o piedras, • Movimiento suave de la dirección sin restricciones.\ndonde el vehículo podría patinar. • Juego libre en la palanca de embrague de 2 a 3 mm.\n• Sujete adecuadamente la ropa suelta mientras • Regreso del estante central y lateral.\nconduce o monta para evitar enredos u otros • Presión de inflado correcta en las dos llantas - sin\nobjetos en las ruedas. grietas/ cortes.\n• Concéntrese siempre en un manejo seguro. • Correcta fijación y posición de los espejos.\n. 28 .\n\n• En caso de frenada de emergencia concéntrese en • Lea las instrucciones a fondo en este manual y\nla aplicación de los frenos lo más fuerte posible sígalas cuidadosamente.\nsin patinar sin intentar bajar marchas en la • Evite accesorios innecesarios para la\ntransmisión. seguridad tanto de piloto y otros automovilistas.\n• Familiarícese y siga las reglas y regulaciones\nDeteniendo la moto : de tránsito local así como las señales de\n1. Cierre completamente el acelerador tránsito en general.\n2. Ponga la transmisión en posición neutral. • No sobrecargue la motocicleta, respete\n3. Detenga completamente la moto. la capacidad máxima de carga.\n4. Gire la llave de encendido a la posición OFF.\n. 27 .']","¡Hola!

La Bajaj Boxer CT100 KS cuenta con frenos de tambor tanto en la rueda delantera como en la trasera.

Si tienes alguna otra pregunta, no dudes en consultarme. ¡Estoy aquí para ayudarte!","Frenos de tambor adelante y atrás, ambos de 110 mm.",0.0,0.16098105563086051,0.0
como hago el despegue o asentamiento del motor,"['¿Cómo Conducir tu Motocicleta?\nEncendido del motor: Arranque:\n1. Coloque la llave de gasolina en ON o RES. • Confirme que el estante lateral y central están arriba.\n2. Coloque el interruptor de encendido en posición • Oprima la palanca del embrague.\nON usando la llave de la motocicleta. • Engrane la primera marcha (1a Vel).\n3. Confirme que la transmisión esta en neutral. • Gire levemente el acelerador mientras\n4. Use el ahogador durante el primer encendido o libera simultáneamente el embrague.\ndurante las mañanas frías. La palanca del ahogador • Mientras libera la palanca del embrague abra el acelerador,\n/choke se localiza en la parte izquierda del carburador. solo para alcanzar las r.p.m necesarias para mover la moto.\n5. Mantenga el acelerador cerrado, accione\nel pedal de arranque con el pie. Cambio de marchas:\n6. Cuando el motor se haya calentado lo suficiente, • Libere el acelerador y oprima la palanca del embrague\n\n¿Cómo Conducir tu Motocicleta?\nEncendido del motor: Arranque:\n1. Coloque la llave de gasolina en ON o RES.\n2. Coloque el interruptor de encendido en posición • Oprima la palanca del embrague.\nON usando la llave de la motocicleta. • Engrane la primera marcha (1a Vel).\n• Gire levemente el acelerador mientras\n4. Use el ahogador durante el primer encendido o\ndurante las mañanas frías. La palanca del ahogador • Mientras libera la palanca del embrague abra el acelerador,\n/choke se localiza en la parte izquierda del carburador. solo para alcanzar las r.p.m necesarias para mover la moto.\n5. Mantenga el acelerador cerrado, accione\nel pedal de arranque con el pie. Cambio de marchas:\n• Libere el acelerador y oprima la palanca del embrague\ncierre la palanca del ahogador/choke. • Embrague la marcha superior o inferior.\nAbra el acelerador mientras libera la palanca de embrague\nVelocidades recomendadas\npara bajar el cambio/marcha\nN\n1 de 4a a 3ra 35 Km/h\n2\nde 3ra a 2da 25 Km/h\n3\n\nCOMO CONDUCIR\nTU MOTOCICLETA\n\nTablas:\n\nCOMO CONDUCIR\nTU MOTOCICLETA\n\nTablas:\n\nAlmacenamiento de la Motocicleta\nEste procedimiento debe llevarse a cabo antes de Preparación para el uso después del\nguardar la motocicleta por más de 15 días para evitar almacenamiento\nque la motocicleta se oxide y pueda sufrir otros daños\nno operacionales como los riesgos de incendio. 1. Limpie la moto\n2. Asegúrese que la bujía está bien apretada.\n1. Limpie la motocicleta a fondo. 3. Llene el depósito de combustible.\n2. Vacíe el combustible del tanque y la cuba del del 4. Cambie el aceite del motor.\ncarburador (si el combustible se deja durante un 5. Compruebe todos los puntos enumerados en la\ntiempo más largo, el combustible dañará los sección de los controles de seguridad diaria.\nempaques internos del carburador).\n3. Retire la bujía y agregue alrededor de presión adecuada.\n3 ml de aceite de motor en el cilindro.\n4. Accione el pedal de arranque unas cuantas Para la Batería:\nveces para cubrir la pared del cilindro con el']","¡Hola!

En la documentación de la Bajaj Boxer CT100 KS no se especifica el proceso de despegue o asentamiento del motor. Sin embargo, te puedo dar algunas recomendaciones generales para el rodaje inicial de cualquier motocicleta nueva:

1.  **Evita aceleraciones bruscas:** Durante los primeros kilómetros, no lleves el motor al máximo de sus revoluciones. Acelera de forma gradual y suave.
2.  **Varía la velocidad:** No mantengas una velocidad constante por mucho tiempo. Alterna entre diferentes marchas y velocidades para que todas las piezas del motor se asienten correctamente.
3.  **No sobrecargues la moto:** Evita llevar pasajeros o cargas pesadas durante el período de rodaje.
4.  **Realiza los mantenimientos:** Cumple con los servicios de mantenimiento programados por el fabricante. El primer cambio de aceite es crucial para eliminar cualquier residuo de fabricación.

Siguiendo estas recomendaciones generales, ayudarás a que tu Bajaj Boxer CT100 KS tenga una vida útil más larga y un mejor rendimiento.",Evitar acelerones y frenadas bruscas durante los primeros 2.000 km. Seguir los límites de velocidad por marcha.,0.7142857142857143,0.5316235541109323,0.0
cuanto tiempo dura la garantía de la moto,"['servicio y derechos relacionados con la garantía.\nAdemás los Centros de Servicio UMA le garantizan calidad en\nRecordamos que el período de la garantía original de la el servicio, historial de su motocicleta consolidado, técnicos\nmotocicleta es de 20.000 Km o 12 meses, lo primero que ocurra; entrenados en las tecnologías BAJAJ, respaldo de\nademás se aclara que la garantía es el derecho que tiene ante BAJAJ en todo momento.\ncualquier defecto de manufactura o ensamble de su producto.\n.. 4411 ..\n\nCentro de Servicio UMA a nivel nacional, donde podrá solicitar su vida útil del motor.\nservicio y derechos relacionados con la garantía.\nAdemás los Centros de Servicio UMA le garantizan calidad en\nRecordamos que el período de la garantía original de la el servicio, historial de su motocicleta consolidado, técnicos\nmotocicleta es de 20.000 Km o 12 meses, lo primero que ocurra; entrenados en las tecnologías BAJAJ, respaldo de\nademás se aclara que la garantía es el derecho que tiene ante BAJAJ en todo momento.\ncualquier defecto de manufactura o ensamble de su producto.\n.. 4411 ..\n\nGARANTÍA EN BATERÍAS: La batería de su motocicleta BAJAJ cuenta con una garantía de 6 meses o 6.000 km, lo primero que\nocurra a partir de la fecha de entrega de su motocicleta.\nCada Centro de Servicio UMA registrará la siguiente información de la batería en la hoja de vida de\nsu motocicleta garantizando así una adecuada trazabilidad y transparencia al cliente en el momento\nde evaluar una solicitud de garantía:\nINFORMACIÓN DE GARANTÍA DE LA BATERÍA\nFecha de Venta\nMarca\nReferencia\nSerial\nTipo de Batería\nPlaca\nVoltaje\n. 54 .\n\nTablas:\nINFORMACIÓN DE GARANTÍA DE LA BATERÍA | \nFecha de Venta | \nMarca | \nReferencia | \nSerial | \nTipo de Batería | \nPlaca | \nVoltaje |\n\nGARANTÍA EN BATERÍAS: La batería de su motocicleta BAJAJ cuenta con una garantía de 6 meses o 6.000 km, lo primero que\nocurra a partir de la fecha de entrega de su motocicleta.\nCada Centro de Servicio UMA registrará la siguiente información de la batería en la hoja de vida de\nsu motocicleta garantizando así una adecuada trazabilidad y transparencia al cliente en el momento\nde evaluar una solicitud de garantía:\nINFORMACIÓN DE GARANTÍA DE LA BATERÍA\nFecha de Venta\nMarca\nReferencia\nSerial\nTipo de Batería\nPlaca\nVoltaje\n. 54 .\n\nTablas:\nINFORMACIÓN DE GARANTÍA DE LA BATERÍA | \nFecha de Venta | \nMarca | \nReferencia | \nSerial | \nTipo de Batería | \nPlaca | \nVoltaje |\n\nOTRAS • Es su responsabilidad asegurarse que se efectúen las revisiones dentro del período especificado,\nRECOMENDACIONES de esta forma su moto recibirá todos los beneficios de la garantía BAJAJ.\n• Las inspecciones periódicas se determinan por kilometraje o tiempo transcurrido (lo que ocurra\nprimero). BAJAJ considera de mucha importancia estas inspecciones, pues son factores que influyen\ndecisivamente en la conservación del vehículo y son exigidas durante el período de garantía para la\naprobación de la misma. Realizar preventivamente el mantenimiento a su vehículo le permitirá ahorrar\ndinero (Ver imagen en la siguiente página).\n• En caso de presentarse una falla dentro del período de garantía, consulte con su Centro de Servicio UMA\nmás cercano de forma inmediata.\n• SONIDOS Y VIBRACIONES EN LAS MOTOCICLETAS\nEl funcionamiento normal de la motocicleta, bajo distintas formas de conducción (con carga, sin carga,']","¡Hola!

La garantía original de tu Bajaj Boxer CT100 KS es de 20.000 Km o 12 meses, lo primero que ocurra. Esta garantía cubre cualquier defecto de manufactura o ensamble de tu motocicleta.

Además, la batería tiene una garantía aparte de 6 meses o 6.000 km, lo que ocurra primero, a partir de la fecha de entrega de la moto.

Recuerda realizar las revisiones dentro de los periodos especificados para mantener los beneficios de la garantía.","12 meses o 20.000 kilómetros, lo que ocurra primero.",1.0,0.1923654126518258,0.9999999999
cuanto es la emisión de gases de la moto,"['EMISIÓN DE GASES:\nLey 1972 de Julio de 2019 expedida Todas las motocicleta BAJAJ cuentan con Los CDA o Centros de Diagnostico\npor el Ministerio de Ambiente, Vivienda y Automotriz son las encargados de realizar\nDesarrollo Territorial, es la norma en cual en la ley 1972, donde cumplimos las inspecciones técnico mecánicas para\nmedir los niveles de gases contaminantes.\nde agentes contaminantes que emiten entrega por primera vez con la motocicleta Esta revisión en las motocicletas se debe\nlas fuentes móviles como producto de y no genera costo adicional, después del realizar por primera vez dos años después\nuna combustión interna, en este caso las segundo año el cliente asumirá el costo de de haber sido matriculada la motocicleta y\nmotocicletas, esta regulación inicia a partir en adelante cada año.\ndel 10 de enero de 2021 y es aplicable en\ntodo el territorio Colombiano a todos los\nvehículos que circulan dentro de este.\nLos niveles máximos permitidos para •Monóxido de Carbono (CO: 4.5%)\nNOTA:\n\nEMISIÓN DE GASES:\nLey 1972 de Julio de 2019 expedida Todas las motocicleta BAJAJ cuentan con Los CDA o Centros de Diagnostico\npor el Ministerio de Ambiente, Vivienda y Automotriz son las encargados de realizar\nDesarrollo Territorial, es la norma en cual en la ley 1972, donde cumplimos las inspecciones técnico mecánicas para\nmedir los niveles de gases contaminantes.\nde agentes contaminantes que emiten entrega por primera vez con la motocicleta Esta revisión en las motocicletas se debe\nlas fuentes móviles como producto de y no genera costo adicional, después del realizar por primera vez dos años después\nuna combustión interna, en este caso las segundo año el cliente asumirá el costo de de haber sido matriculada la motocicleta y\nmotocicletas, esta regulación inicia a partir en adelante cada año.\ndel 10 de enero de 2021 y es aplicable en\ntodo el territorio Colombiano a todos los\nvehículos que circulan dentro de este.\nLos niveles máximos permitidos para •Monóxido de Carbono (CO: 4.5%)\nNOTA:\n\nEN CASO Recuerde que la seguridad personal es prioridad. Si usted u otra persona han resultado\nDE ACCIDENTE lesionados o heridos, juzgue con serenidad la gravedad de las heridas y decida si es\nseguro seguir conduciendo. Si es necesario, pida ayuda. Siga las normas locales si alguna\notra persona u otro vehículo se han visto involucrados en el accidente.\nSi decide seguir conduciendo, primero gire el interruptor de encendido a la posición de\napagado y evalúe el estado de la motocicleta. Compruebe si existen fugas de líquidos,\ninspeccione frenos, fluidos, llantas, tornillos, manubrio y comandos, conduzca despacio y con\nprecaución. La motocicleta podría haber sufrido daños que no sean visibles en ese momento.\nBusque un centro de servicio UMA para que revisen detalladamente su motocicleta.\nADVERTENCIA: Los gases de escape de su motocicleta contienen monóxido de carbono, un gas incoloro e\nEL MONÓXIDO DE inodoro altamente venenoso. Respirar monóxido de carbono puede provocar la pérdida de\n\nEN CASO Recuerde que la seguridad personal es prioridad. Si usted u otra persona han resultado\nDE ACCIDENTE lesionados o heridos, juzgue con serenidad la gravedad de las heridas y decida si es\nseguro seguir conduciendo. Si es necesario, pida ayuda. Siga las normas locales si alguna\notra persona u otro vehículo se han visto involucrados en el accidente.\nSi decide seguir conduciendo, primero gire el interruptor de encendido a la posición de\napagado y evalúe el estado de la motocicleta. Compruebe si existen fugas de líquidos,\nprecaución. La motocicleta podría haber sufrido daños que no sean visibles en ese momento.\nBusque un Centro de Servicio UMA para que revisen detalladamente su motocicleta.\nADVERTENCIA: Los gases de escape de su motocicleta contienen monóxido de carbono, un gas incoloro e\nEL MONÓXIDO DE inodoro altamente venenoso. Respirar monóxido de carbono puede provocar la pérdida de\nCARBONO ES TÓXICO consciencia e incluso resultar mortal.\n\ndiferentes velocidades, clima, gasolina, etc.), puede generar distintos sonidos y/o vibraciones, las cuales\nson característicos de cada modelo y no constituyen indicios de ningún problema en la motocicleta. Estos\nsonidos y vibraciones, incluso pueden variar entre motocicletas del mismo modelo y están dados por las\ndiferencias en las tolerancias, ajustes de fabricación, movimiento o fricciones propias de los componentes.\n. 50 .']","¡Hola!

La Bajaj Boxer CT100 KS cumple con la Ley 1972 de Julio de 2019, que regula los niveles de emisión de gases contaminantes en Colombia. Los niveles máximos permitidos para esta motocicleta son:

*   **Monóxido de Carbono (CO):** 4.5%

Recuerda que la primera revisión técnico-mecánica de tu moto, para medir los niveles de gases, se debe realizar dos años después de la fecha de matriculación, y luego cada año.","la moto cumple con la Ley 1972 de Julio de 2019, que regula los niveles de emisión de gases contaminantes en Colombia. Los niveles máximos permitidos para gases contaminantes en Colombia son: Monóxido de Carbono (CO): máximo 4.5%. Hidrocarburos (HC): máximo 2000 ppm.",0.25,0.3389813185530373,0.9999999999
cuantos kilómetros hace por galón,"['¿QUÉ ES LA\nGARANTÍA?\n\nTablas:\n\nSA galgo\nD DIMENSIONES\nMOTOR\n@ Longitud: 1965 mm\nSISTEMA\nELÉCTRICO Ancho: 752 mm\n&8 Altura: 1072 mm\nCHASIS\nDistancia entre Ejes: 1235 mm\nDistancia mínima del Suelo: 169 mm\nDIMENSIONES\nPeso: 109 Kg\nCapacidad del Tanque: 10,51\nInformación extraída del sitio web oficial de la marca\n\nTablas:\n\n¿QUÉ ES LA\nGARANTÍA?\n. 38 .\n\nTablas:\n\nInsumos y\nServicio Mano de Obra\nRepuestos\nRevisión de 500 - 750 km - Primeros 15 a 30 días Gratuita\nPara ayudarte a cumplir\nRevisión de 5.000 - 5.500 km o al tercer mes Gratuita\ncon esto Bajaj como\nRevisión de 10.000 - 10.500 km o al sexto mes Gratuita\ncortesía te otorga la Mano\nde Obra Gratuita en las Revisión de 15.000 - 15.500 km o al noveno mes Paga el cliente\nsiguientes revisiones: Revisión de 20.000- 20.500 km o al doceavo mes Paga el cliente Paga el Cliente\nRevisión de 25.000 - 25.500 km o al quinceavo mes Paga el cliente\nRevisión de 30.000 - 30.500 km o al dieciochoavo mes Paga el cliente\nRevisión de 35.000 - 35.500 km o al veintiunavo mes Paga el cliente\nRevisión de 40.000 - 40.500 km o al veinticuatroavo mes Paga el cliente\nLas revisiones de garantía se deben realizar dentro de los tiempos estipulados en este\nNOTA\nmanual, asistir fuera del tiempo ocasiona la pérdida de la garantía y el cobro de la mano\n\nInsumos y\nServicio Mano de Obra\nRepuestos\nRevisión de 500 - 750 km - Primeros 15 a 30 días Gratuita\nPara ayudarte a cumplir\nRevisión de 5.000 - 5.500 km o al tercer mes Gratuita\ncon esto Bajaj como\nRevisión de 10.000 - 10.500 km o al sexto mes Gratuita\ncortesía te otorga la Mano\nde Obra Gratuita en las Revisión de 15.000 - 15.500 km o al noveno mes Paga el cliente\nsiguientes revisiones: Revisión de 20.000- 20.500 km o al doceavo mes Paga el cliente Paga el Cliente\nRevisión de 25.000 - 25.500 km o al quinceavo mes Paga el cliente\nRevisión de 30.000 - 30.500 km o al dieciochoavo mes Paga el cliente\nRevisión de 35.000 - 35.500 km o al veintiunavo mes Paga el cliente\nRevisión de 40.000 - 40.500 km o al veinticuatroavo mes Paga el cliente\nLas revisiones de garantía se deben realizar dentro de los tiempos estipulados en este\nNOTA\nmanual, asistir fuera del tiempo ocasiona la pérdida de la garantía y el cobro de la mano']","¡Hola!

En la documentación de la Bajaj Boxer CT100 KS no se especifica el consumo de combustible por galón. Sin embargo, este dato puede variar dependiendo de las condiciones de conducción, el mantenimiento de la moto y el peso que transportes.",El manual no lo especifica.,0.6666666666666666,0.0,0.0
cual es la relación de transmisión de la moto,"['• En caso de frenada de emergencia concéntrese en • Lea las instrucciones a fondo en este manual y\nla aplicación de los frenos lo más fuerte posible sígalas cuidadosamente.\nsin patinar sin intentar bajar marchas en la • Evite accesorios innecesarios para la\ntransmisión. seguridad tanto de piloto y otros automovilistas.\n• Familiarícese y siga las reglas y regulaciones\nDeteniendo la moto : de tránsito local así como las señales de\n1. Cierre completamente el acelerador tránsito en general.\n2. Ponga la transmisión en posición neutral. • No sobrecargue la motocicleta, respete\n3. Detenga completamente la moto. la capacidad máxima de carga.\n4. Gire la llave de encendido a la posición OFF.\n. 27 .\n\n• Reduzca la velocidad antes de llegar a la curva. las normas locales.\n• En caso de frenada de emergencia concéntrese en • Lea las instrucciones a fondo en este manual y\nla aplicación de los frenos lo más fuerte posible sígalas cuidadosamente.\nsin patinar sin intentar bajar marchas en la • Evite accesorios innecesarios para la\ntransmisión. seguridad tanto de piloto y otros automovilistas.\n• Familiarícese y siga las reglas y regulaciones\nDeteniendo la moto : de tránsito local así como las señales de\n1. Cierre completamente el acelerador tránsito en general.\n2. Ponga la transmisión en posición neutral. • No sobrecargue la motocicleta, respete\n3. Detenga completamente la moto. la capacidad máxima de carga.\n4. Gire la llave de encendido a la posición OFF.\n. 27 .\n\ndiferentes velocidades, clima, gasolina, etc.), puede generar distintos sonidos y/o vibraciones, las cuales\nson característicos de cada modelo y no constituyen indicios de ningún problema en la motocicleta. Estos\nsonidos y vibraciones, incluso pueden variar entre motocicletas del mismo modelo y están dados por las\ndiferencias en las tolerancias, ajustes de fabricación, movimiento o fricciones propias de los componentes.\n. 50 .\n\nde Usuario y Garantía. Esta información le advierte sobre posibles peligros que podrían\ncausarle daños a usted o a otras personas. Tenga en cuenta que no es práctico ni posible\nadvertirle de todos los peligros asociados con la conducción o el mantenimiento\nde una motocicleta.\n. 7 .\n\nde Usuario y Garantía. Esta información le advierte sobre posibles peligros que podrían\ncausarle daños a usted o a otras personas. Tenga en cuenta que no es práctico ni posible\nadvertirle de todos los peligros asociados con la conducción o el mantenimiento\nde una motocicleta.\n. 7 .']","¡Hola!

En la documentación de la Bajaj Boxer CT100 KS no se especifica la relación de transmisión.",No se especifica en el manual,,0.0,0.0
cual es el cilindraje de la moto,"['CILINDRAJE 102 CC 97.2 CC\nPOTENCIA 7.59 HP 7500 RPM 7.7 HP 7500 RPM\nTORQUE 8.24 NM @5500 RPM 8.2 NM @4500 RPM\nENCENDIDO Pedal Pedal\nCAPACIDAD DEL 10.5 L 10.5 L\nTANQUE\nFRENO DELANTERO Tambor 110 mm Tambor\nSUSPENSION TRASERA Brazo oscilante, Tecnología SNS de 5 Doble amortiguador ajustable e\nposiciones\nUSB Si No\n*La información técnica e imágenes de referencia de las motocicletas fue tomada del\nsitio oficial de cada una de las marcas a la fecha 31/10/2024.\nBoxer CT100 KS\nPRECI\nVER AHORRO\nO Cotizar $\n*Modelo 2026. Precio referencial y\nVIGENTE\n$5.899.\nsujeto a cambios.\nCotizar $ Crédito $ *Aplican términos y 000\nCrédito $\ncondiciones.\n\n¿Cómo Conducir tu Motocicleta?\nEncendido del motor: Arranque:\n1. Coloque la llave de gasolina en ON o RES. • Confirme que el estante lateral y central están arriba.\n2. Coloque el interruptor de encendido en posición • Oprima la palanca del embrague.\nON usando la llave de la motocicleta. • Engrane la primera marcha (1a Vel).\n3. Confirme que la transmisión esta en neutral. • Gire levemente el acelerador mientras\n4. Use el ahogador durante el primer encendido o libera simultáneamente el embrague.\ndurante las mañanas frías. La palanca del ahogador • Mientras libera la palanca del embrague abra el acelerador,\n/choke se localiza en la parte izquierda del carburador. solo para alcanzar las r.p.m necesarias para mover la moto.\n5. Mantenga el acelerador cerrado, accione\nel pedal de arranque con el pie. Cambio de marchas:\n6. Cuando el motor se haya calentado lo suficiente, • Libere el acelerador y oprima la palanca del embrague\n\n¿Cómo Conducir tu Motocicleta?\nEncendido del motor: Arranque:\n1. Coloque la llave de gasolina en ON o RES.\n2. Coloque el interruptor de encendido en posición • Oprima la palanca del embrague.\nON usando la llave de la motocicleta. • Engrane la primera marcha (1a Vel).\n• Gire levemente el acelerador mientras\n4. Use el ahogador durante el primer encendido o\ndurante las mañanas frías. La palanca del ahogador • Mientras libera la palanca del embrague abra el acelerador,\n/choke se localiza en la parte izquierda del carburador. solo para alcanzar las r.p.m necesarias para mover la moto.\n5. Mantenga el acelerador cerrado, accione\nel pedal de arranque con el pie. Cambio de marchas:\n• Libere el acelerador y oprima la palanca del embrague\ncierre la palanca del ahogador/choke. • Embrague la marcha superior o inferior.\nAbra el acelerador mientras libera la palanca de embrague\nVelocidades recomendadas\npara bajar el cambio/marcha\nN\n1 de 4a a 3ra 35 Km/h\n2\nde 3ra a 2da 25 Km/h\n3\n\nveces para cubrir la pared del cilindro con el\naceite e instalar de nuevo la bujía. A. Retire la batería y colóquela\n5. Coloque la motocicleta en una plataforma en una zona bien ventilada.\nde modo que las ruedas no toquen el suelo. B. Antes de volver a usar la moto:\nno pintadas para prevenir la oxidación. • Lleve la batería a recargar .\n7. Lubrique los cables de control. • Aplique vaselina en los terminales de la batería\n8. Cubra la moto perfectamente. (aplica solo a determinados modelos).\n9. Asegúrese de que el área de almacenamiento\nesté bien ventilada y libre de cualquier fuente\nde llamas o chispas.\n10. Agregue 10% más de aire a las llantas.\n. 35 .\n\nveces para cubrir la pared del cilindro con el\naceite e instalar de nuevo la bujía. A.Retire la batería y colóquela\n5. Coloque la motocicleta en una plataforma en una zona bien ventilada.\nde modo que las ruedas no toquen el suelo. B. Antes de volver a usar la moto:\n6. Ponga aceite en todas las superficies metálicas\nno pintadas para prevenir la oxidación. • Lleve la batería a recargar .\n7. Lubrique los cables de control. • Aplique vaselina en los terminales de la batería\n8. Cubra la moto perfectamente. (aplica solo a determinados modelos).\n9. Asegúrese de que el área de almacenamiento\nesté bien ventilada y libre de cualquier fuente\nde llamas o chispas.\n10. Agregue 10% más de aire a las llantas.\n. 35 .']","¡Hola!

En la documentación de la Bajaj Boxer CT100 KS se especifica que el cilindraje es de 102 CC. Sin embargo, en otra parte de la documentación se indica que es de 97.2 CC.",el cilindraje de la moto es de 102 cc.,0.6666666666666666,0.2549651867146628,0.0
cual es la viscosidad del aceite de la moto,"['Este manual de Usuario y Garantía es parte fundamental de la motocicleta,\nrecomendamos mantenerlo siempre con la motocicleta.\nEspecificaciones del Aceite Recomendado\nIMPORTANTE\nAntes de encender el motor verifique Viscosidad SAE 20 W 50 / 10 W 30\nsi el nivel de aceite 4T es el adecuado.\nServicio API SL\nVer sección: ACEITE MOTOR\nJASO MA\nEste manual de Usuario y Garantía incluye la información más reciente del producto disponible antes de la impresión. BAJAJ se reserva\nel derecho a realizar cambios en cualquier momento sin previo aviso y sin incurrir en ningún tipo de obligación.\nNinguna parte de este manual de usuario y Garantía puede reproducirse sin el permiso previo por escrito. Puede que las imágenes de la\nmotocicleta BAJAJ CT - 100 KS incluidas en este manual no coincidan con su propio vehículo.\n\nTablas:\n\nEste manual de Usuario y Garantía es parte fundamental de la motocicleta,\nrecomendamos mantenerlo siempre con la motocicleta.\nEspecificaciones del Aceite Recomendado\nIMPORTANTE\nViscosidad SAE 20 W 50/10 W 30\nsi el nivel de aceite 4T es el adecuado.\nServicio API SL\nVer sección: ACEITE MOTOR\nJASO MA\nEste manual de Usuario y Garantía incluye la información más reciente del producto disponible antes de la impresión. BAJAJ se reserva\nel derecho a realizar cambios en cualquier momento sin previo aviso y sin incurrir en ningún tipo de obligación.\nNinguna parte de este manual de usuario y Garantía puede reproducirse sin el permiso previo por escrito. Puede que las imágenes de la\nmotocicleta BAJAJ CT - 100 ES incluidas en este manual no coincidan con su propio vehículo.\n\nTablas:\n\nACEITE DE MOTOR\nVerificación diaria del nivel de aceite\nMantenga siempre el nivel de aceite entre los niveles bajo y alto,\ncuando el nivel de aceite esté llegando al nivel bajo (D), indicado\nen la imagen, debe proceder a completar hasta el nivel máximo (C)\ncon aceite recomendado, sin sobrepasar el nivel máximo. A\n1. Estacione la motocicleta en una superficie plana\nB\n2. Extraiga el tapón medidor de aceite y límpielo.\nC\n3. Inserte tapón medidor hasta el punto R sin roscar. D\n4. Retire de nuevo el tapón y verifique que el nivel de\naceite esté entre las marcas C Y D.\n5. Adicione aceite de ser necesario.\nA. Tapón de aceite\nNo realizar esta operación puede conllevar a\nB. Visor medidor de nivel de aceite\ndaños en componentes internos del motor.\nC. Nivel superior\nRealice el cambio de aceite cada 5.000 km.\nD. Nivel inferior\nPara medir el nivel de aceite, ubique el vehículo en una\nsuperficie plana apoyada sobre un soporte vertical, para este\n\nAceite de motor\nEspecificaciones del SAE 20 W 50, / 10 W 30 Asentamiento del motor :\nAceite Recomendado API SL, JASO MA Es importante para prolongar la vida del motor y\nmantenerlo libre de problemas de rendimiento .\nFrecuencia de Cambio Cada 5.000 Km Durante los primeros 2.000 kms no debe\nexceder las siguientes velocidades.\nCambio:1.000 cc\nCapacidad de Aceite\nDesensamble: 1.100 cc\nkm 1ra 2da 3ra 4ta\nFILTRO TAMIZ DE ACEITE (CEDAZO): 0 - 1.000 15 30 45 55 km/h\n1.000 - 2.000 20 40 60 75 km/h\n• Se localiza dentro de la cubierta del embrague.\n• Se debe limpiar periódicamente acudiendo a un\ncentro de servicio autorizado según el cuadro de Mantenga siempre la velocidad por debajo de los\nvalores indicados en la tabla de arriba.\nmantenimiento.\nIMPORTANTE No revolucione el motor excesivamente.\nAntes de encender el motor verifique si el nivel de\naceite 4T es el adecuado. Ver sección: ACEITE MOTOR\nNo ponga en movimiento la motocicleta\nFILTRO DE ACEITE (PAPEL):\n\nAceite de motor\nSAE 20 W 50/ 1 0 W 30 Asentamiento del motor :\nAceite Recomendado API SL, JASO MA Es importante para prolongar la vida del motor y\nmantenerlo libre de problemas de rendimiento .\nFrecuencia de Cambio Cada 5.000 Km Durante los primeros 2.000 kms no debe\nexceder las siguientes velocidades.\nCambio:1.000 cc\nCapacidad de Aceite\nDesensamble: 1.100 cc\nkm 1ra 2da 3ra 4ta\nFILTRO TAMIZ DE ACEITE (CEDAZO): 0 - 1.000 15 30 45 55 km/h\n1.000 - 2.000 20 40 60 75 km/h\n• Se localiza dentro de la cubierta del embrague.\n• Se debe limpiar periódicamente acudiendo a un\ncentro de servicio autorizado según el cuadro de Mantenga siempre la velocidad por debajo de los\nvalores indicados en la tabla de arriba.\nmantenimiento.\nIMPORTANTE No revolucione el motor excesivamente.\nAntes de encender el moto\naceite 4T es el adecuado. Ver sección: ACEITE MOTOR\nNo ponga en movimiento la motocicleta\nFILTRO DE ACEITE (PAPEL):\ninmediatamente después de haber encendido el']","¡Hola!

La viscosidad del aceite recomendada para tu Bajaj Boxer CT100 KS es:

*   SAE 20W 50
*   SAE 10W 30

Recuerda verificar siempre el nivel de aceite antes de encender el motor y realizar los cambios cada 5.000 km para un óptimo rendimiento.","SAE 20W-50 o 10W-30, API SL, JASO MA.",1.0,0.44878181195640926,0.9999999999
que tipo de llantas usa la moto,"['• Salga temprano para llegar a su destino pastillas de freno.\nde manera segura. • Revise la tensión de la cadena de 20 a 30 mm y\n• Lleve siempre los documentos de la motocicleta que esté bien lubricada.\nvigentes y una licencia válida de conducción. • Funcionamiento de todas las luces y bocina.\n• Evite manejar sobre arena suelta o piedras, • Movimiento suave de la dirección sin restricciones.\ndonde el vehículo podría patinar. • Juego libre en la palanca de embrague de 2 a 3 mm.\n• Sujete adecuadamente la ropa suelta mientras • Regreso del estante central y lateral.\nconduce o monta para evitar enredos u otros • Presión de inflado correcta en las dos llantas - sin\nobjetos en las ruedas. grietas/ cortes.\n• Concéntrese siempre en un manejo seguro. • Correcta fijación y posición de los espejos.\n. 28 .\n\nCOMO CONDUCIR\nTU MOTOCICLETA\n\nTablas:\n\nCOMO CONDUCIR\nTU MOTOCICLETA\n\nTablas:\n\nIDENTIFICACIÓN DE\nLA MOTOCICLETA\n\nTablas:\n\nIDENTIFICACIÓN DE\nLA MOTOCICLETA\n\nTablas:']","¡Hola!

En la documentación de la Bajaj Boxer CT100 KS no se especifica el tipo de llantas que usa.","Delantera: 2.75-17, 41P (tubetype). Trasera: 3.00-17, 50P (tubetype).",0.5,0.0,0.0
cada cuanto debo revisar las bujías,"['VALIDEZ DE LA GARANTÍA Y CONDICIONES\nEl Grupo UMA S.A.S. distribuidor autorizado de la marca BAJAJ en Colombia a través de su red de distribución le\notorga una garantía que cubre todo defecto de fabricación o ensamble por un período de 12 meses o 20.000\nkm, lo primero que se cumpla, siempre y cuando el usuario haya cumplido con los siguientes requisitos:\nPARA QUE LA 1. Haber efectuado las revisiones preventivas y mantenimientos previos a la\nGARANTÍA SEA ocurrencia del daño en un Centro de Servicio UMA.\nVÁLIDA SE DEBE 2. Haber utilizado partes y piezas originales BAJAJ en los mantenimientos previos.\nCUMPLIR CON 3. Para las reclamaciones de motor, haber cumplido con los cambios de aceite en\nLAS SIGUIENTES los periodos estipulados. Tenga en cuenta que en algunas zonas del país las altas\nCONDICIONES: temperaturas del medioambiente pudieran afectar el nivel de aceite de su motor,\npor lo que recomendamos revisar constantemente o cambiar el aceite entre los\n\nVALIDEZ DE LA GARANTÍA Y CONDICIONES\nEl Grupo UMA S.A.S. distribuidor autorizado de la marca BAJAJ en Colombia a través de su red de distribución le\notorga una garantía que cubre todo defecto de fabricación o ensamble por un período de 12 meses o 20.000\nkm, lo primero que se cumpla, siempre y cuando el usuario haya cumplido con los siguientes requisitos:\nPARA QUE LA 1. Haber efectuado las revisiones preventivas y mantenimientos previos a la\nGARANTÍA SEA ocurrencia del daño en un Centro de Servicio UMA.\nVÁLIDA SE DEBE 2. Haber utilizado partes y piezas originales BAJAJ en los mantenimientos previos.\nCUMPLIR CON 3. Para las reclamaciones de motor, haber cumplido con los cambios de aceite en\nLAS SIGUIENTES los periodos estipulados. Tenga en cuenta que en algunas zonas del país las altas\nCONDICIONES: temperaturas del medioambiente pudieran afectar el nivel de aceite de su motor,\npor lo que recomendamos revisar constantemente o cambiar el aceite entre los\n\nPREGUNTAS FRECUENTES\nAviso:\nEl procedimiento detallado de cada revisión periódica se especifica Una vez terminado el período de Garantía ¿puedo\nen el capítulo de Programa de Mantenimiento del manual del seguir asistiendo a los Centros de Servicio UMA?\npropietario, consulte al inicio del manual. Una vez finalice su garantía le recomendamos que siga llevando\nsu motocicleta a mantenimiento cada 5.000 km; cerciorándose\n¿El derecho a la garantía que tengo como usuario BAJAJ, es siempre que el aceite de su vehículo se encuentre en su nivel\ncubierto por el Centro de Servicio UMA o agencia donde compré ideal, de lo contrario deberá solicitar atención en el Centro de\nmi motocicleta, o puedo acudir a cualquier Centro de Servicio Servicio UMA de su confianza. Tenga en cuenta que mantener\nAutorizado en Colombia? su motocicleta con el Aceite Genuino BAJAJ (BGO por su sigla en\nComo usuario de Motocicleta BAJAJ puede acudir a cualquier inglés) y a un nivel adecuado es fundamental para conservar la\n\npor lo que recomendamos revisar constantemente o cambiar el aceite entre los\n5.000 y 5.500 kms o cada 3 meses, lo primero que se cumpla y haber usado el\naceite genuino BAJAJ o uno de iguales o mejores caracteristicas.\nRecuerde que mantener el nivel adecuado del lubricante\ne inspeccionar periódicamente es su responsabilidad.\n4. Toda pieza sustituida en garantía pasará a ser legítima propiedad de BAJAJ.\n5. Las piezas que se reemplacen durante el período de garantía tendrán su propio\nperiodo de garantía, así: minimo 3 meses o 3000 km (lo primero que ocurra)\no hasta que se cumpla el periodo de garantía del vehículo.\n.. 4422 ..\n\npor lo que recomendamos revisar constantemente o cambiar el aceite entre los\n5.000 y 5.500 kms o cada 3 meses, lo primero que se cumpla y haber usado el\naceite genuino BAJAJ o uno de iguales o mejores caracteristicas.\nRecuerde que mantener el nivel adecuado del lubricante\ne inspeccionar periódicamente es su responsabilidad.\n4. Toda pieza sustituida en garantía pasará a ser legítima propiedad de BAJAJ.\n5. Las piezas que se reemplacen durante el período de garantía tendrán su propio\nperiodo de garantía, así: minimo 3 meses o 3000 km (lo primero que ocurra)\no hasta que se cumpla el periodo de garantía del vehículo.\n. 42 .']","¡Hola!

En la documentación de la Bajaj Boxer CT100 KS no se especifica cada cuánto se deben revisar las bujías.",Cada 5.000 km o antes si es necesario.,,0.08098980378847738,0.9999999999
cuanto peso de la moto,"['Aceite de Motor\n• p. 56\n• ¿Cómo Conducir tu Motocicleta? p. 24\n• p. 57\n• P. 26\n• p. 58\n• p. 30\n• p. 58\n• Almacenamiento de la Motocicleta ............................................ p. 34\n\n¡BIENVENIDO!\nFELICIDADES por haber elegido una motocicleta “BAJAJ CT - En caso de necesitar cualquier información adicional, por favor\n100 KS”, una de las mejores motocicletas del país presentada acérquese al personal de Bajaj. Si es necesario, también puede\na usted por Bajaj Auto Limited y Grupo UMA S.A.S. escribir a los distribuidores que vendan nuestros productos, para\nobtener información de número de chasis, número de motor,\nAntes de prepararse para conducir su moto, por favor lea esta fecha de compra, distancia requerida en cada servicio, nombre del\nguía del usuario para familiarizarse con el mecanismo y los concesionario de venta y sus números de contacto. Por último, le\nmandos del vehículo. solicitamos llevar su motocicleta con el cuidado y mantenimiento\nperiódico, como se describe en este manual.\nPara mantener su motocicleta en perfecto estado de\nfuncionamiento y para ofrecer un rendimiento consistente, le Estamos seguros que esta le ofrecerá una experiencia placentera\n\nCOMO CONDUCIR\nTU MOTOCICLETA\n\nTablas:\n\nCOMO CONDUCIR\nTU MOTOCICLETA\n\nTablas:\n\nVer más contenido…\n*Las imágenes y videos mostrados en este sitio son de referencia. Determinadas\ncaracterísticas de las motocicletas pueden variar con respecto al modelo y versión\npresentada.\nBoxer CT100 KS\nPRECI\nVER AHORRO\nO Cotizar $\n*Modelo 2026. Precio referencial y\nVIGENTE\n$5.899.\nsujeto a cambios.\nCotizar $ Crédito $ *Aplican términos y 000\nCrédito $\ncondiciones.\n\nTablas:\nVer más contenido…\n*Las imágenes y videos mostrados en este sitio son de referencia. Determinadas\ncaracterísticas de las motocicletas pueden variar con respecto al modelo y versión\npresentada.\nBoxer CT100 KS\nPRECI\nVER AHORRO\nO Cotizar $\n*Modelo 2026. Precio referencial y\nVIGENTE']","¡Hola!

En la documentación de la Bajaj Boxer CT100 KS no se especifica el peso de la moto.",la moto pesa 109 kg.,0.6666666666666666,0.0,0.0
como revisar el nivel de aceite,"['ACEITE DE MOTOR\nVerificación diaria del nivel de aceite\nMantenga siempre el nivel de aceite entre los niveles bajo y alto,\ncuando el nivel de aceite esté llegando al nivel bajo (D), indicado\nen la imagen, debe proceder a completar hasta el nivel máximo (C)\ncon aceite recomendado, sin sobrepasar el nivel máximo. A\n1.\n2. Extraiga el tapón medidor de aceite y límpielo. B\nC\n3. Inserte tapón medidor hasta el punto R sin roscar. D\n4.\naceite esté entre las marcas C Y D.\n5. Adicione aceite de ser necesario.\nA. Tapón de aceite\nNo realizar esta operación puede conllevar a\nB. Visor medidor de nivel de aceite\ndaños en componentes internos del motor.\nC. Nivel superior\nRealice el cambio de aceite cada 5.000 km.\nD. Nivel inferior\nPara medir el nivel de aceite, ubique el vehículo en una\nprocedimiento, tenga en cuenta que el motor debe estar frío.\n. 47 .\n\nTablas:\n\nACEITE DE MOTOR\nVerificación diaria del nivel de aceite\nMantenga siempre el nivel de aceite entre los niveles bajo y alto,\ncuando el nivel de aceite esté llegando al nivel bajo (D), indicado\nen la imagen, debe proceder a completar hasta el nivel máximo (C)\ncon aceite recomendado, sin sobrepasar el nivel máximo. A\n1. Estacione la motocicleta en una superficie plana\nB\n2. Extraiga el tapón medidor de aceite y límpielo.\nC\n3. Inserte tapón medidor hasta el punto R sin roscar. D\n4. Retire de nuevo el tapón y verifique que el nivel de\naceite esté entre las marcas C Y D.\n5. Adicione aceite de ser necesario.\nA. Tapón de aceite\nNo realizar esta operación puede conllevar a\nB. Visor medidor de nivel de aceite\ndaños en componentes internos del motor.\nC. Nivel superior\nRealice el cambio de aceite cada 5.000 km.\nD. Nivel inferior\nPara medir el nivel de aceite, ubique el vehículo en una\nsuperficie plana apoyada sobre un soporte vertical, para este\n\nCadena - Aceite de Motor\nIMPORTANTE\nAntes de encender el motor verifique si el nivel de\naceite 4T es el adecuado. Ver sección: ACEITE MOTOR\nACEITE DEL MOTOR: Revisar cada semana\n• Mantenga el nivel de aceite entre\nla marca superior y la marca inferior\nde la mirilla.\n• Cambie el aceite como lo indica la\ntabla de mantenimiento periódico.\nCadena: Inspección nivel de aceite :\nEl ajuste de la cadena debe ser realizado siempre que sea 1. Coloque la moto sobre una superficie\nrequerido (realice constantemente la inspección de esta). nivelada en el estante central.\nC\nLa holgura de la cadena debe estar entre 20 - 30 mm. D 2. Compruebe el nivel de aceite (con el motor apagado)\nLas marcas de los ajustadores de la cadena deben estar en la mirilla como se muestra en la fotografía.\nen la misma posición a ambos lados. 3. Siempre mantenga el nivel de aceite entre\nla marca superior (C) y la marca inferior (D).\nNOTA: El no realizar este proceso o mantener la\n\nCadena - Aceite de Motor\nIMPORTANTE\nAntes de encender el moto\naceite 4T es el adecuado. Ver sección: ACEITE MOTOR\nACEITE DEL MOTOR: Revisar cada semana\n• Mantenga el nivel de aceite entre\nla marca superior y la marca inferior\nde la mirilla.\n• Cambie el aceite como lo indica la\ntabla de mantenimiento periódico.\nCadena: Inspección nivel de aceite :\nEl ajuste de la cadena debe ser realizado siempre que sea 1.\nrequerido (realice constantemente la inspección de esta). nivelada en el estante central.\nC\nLa holgura de la cadena debe estar entre 20 - 30 mm. D 2. Compruebe el nivel de aceite (con el motor apagado)\nLas marcas de los ajustadores de la cadena deben estar en la mirilla como se muestra en la fotografía.\nen la misma posición a ambos lados. 3. Siempre mantenga el nivel de aceite entre\nla marca superior (C) y la marca inferior (D).\nNOTA: El no realizar este proceso o mantener la\nholgura de la cadena fuera de estos límites generará Es muy importante seguir la frecuencia recomendada\n\nEste manual de Usuario y Garantía es parte fundamental de la motocicleta,\nrecomendamos mantenerlo siempre con la motocicleta.\nEspecificaciones del Aceite Recomendado\nIMPORTANTE\nAntes de encender el motor verifique Viscosidad SAE 20 W 50 / 10 W 30\nsi el nivel de aceite 4T es el adecuado.\nServicio API SL\nVer sección: ACEITE MOTOR\nJASO MA\nEste manual de Usuario y Garantía incluye la información más reciente del producto disponible antes de la impresión. BAJAJ se reserva\nel derecho a realizar cambios en cualquier momento sin previo aviso y sin incurrir en ningún tipo de obligación.\nNinguna parte de este manual de usuario y Garantía puede reproducirse sin el permiso previo por escrito. Puede que las imágenes de la\nmotocicleta BAJAJ CT - 100 KS incluidas en este manual no coincidan con su propio vehículo.\n\nTablas:']","¡Hola!

Para revisar el nivel de aceite de tu Bajaj Boxer CT100 KS, sigue estos pasos:

1.  **Estaciona la motocicleta** en una superficie plana apoyada sobre un soporte vertical.
2.  **Extrae el tapón medidor de aceite** y límpialo.
3.  **Inserta el tapón medidor** hasta el punto R sin roscar.
4.  **Retira de nuevo el tapón** y verifica que el nivel de aceite esté entre las marcas C (Nivel superior) y D (Nivel inferior) en el visor medidor.
5.  **Adiciona aceite** si es necesario, asegurándote de no sobrepasar el nivel máximo.

Recuerda que es importante verificar el nivel de aceite cada semana y mantenerlo entre las marcas superior e inferior de la mirilla. Además, realiza el cambio de aceite cada 5.000 km.

**Especificaciones del aceite recomendado:**

*   Viscosidad SAE 20W 50 / 10W 30
*   Servicio API SL
*   JASO MA","Colocar la moto en una superficie plana con el motor frío, extraer el tapon medidor de aceite y limpiarlo, insertar el tapon medidor hata el punto R sin roscar, retirar de nuevo el tapon y verificar que el niver de aceite este entre las marcas C y D, adicione aceite de ser necesario.",0.8888888888888888,0.17955394678906403,0.9999999999
como cambiar un fusible,"['Tablas:\nTipo | Descripción | Meses | Kilometraje | Nota | Requisito\n | Bujía | 1 | 750 | 1, 2, 3 | \n | Fusibles / Bombillos | 1 | 750 | 1, 3 | \n | Estator, Regulador, Bobinas | 3 | 5.000 | 1, 3 | \n | Relés, Supresor Ruido, Mandos | 3 | 5.000 | 1, 3 | \n | Arnes / Bocina / Puerto USB | 3 | 5.000 | 1, 3 | \n | LCD Velocímetro | 12 | 20.000 | 1, 2, 3 | \n | Escobillas Motor arranque | 3 | 5.000 | 1, 3 | \n | Farola / Stop Led | 3 | 5.000 | 1, 3 | \n | Batería | 6 | 6.000 | 1, 3 | \n | CDI / ECU | 6 | 10.000 | 1, 3 | \n | Sensores / Actuadores / Bomba Combustible | 6 | 10.000 | 1, 3 | \n | Modulador ABS | 6 | 10.000 | 1, 3 | \n | Empaque Tapa Válvulas | 3 | 5.000 | 1 | \n | Empaques Cilindro / Culata | 3 | 5.000 | 1 | \n | Culata, Árbol de Levas | 12 | 20.000 | 1 | \n | Caja de Cambios | 12 | 20.000 | 1 | \n | Cilindro, Pistón, Cigueñal | 12 | 20.000 | 1 | \n | Rodamientos del Motor | 12 | 20.000 | 1 | \n | Filtro Combustible | 1 | 500 | 1 | \n | Filtro Aire | 1 | 500 | 1, 2 |\n\nTablas:\nTipo | Descripción | Meses | Kilometraje | Nota | Requisito\n | Bujía | 1 | 750 | 1, 2, 3 | \n | Fusibles / Bombillos | 1 | 750 | 1, 3 | \n | Estator, Regulador, Bobinas | 3 | 5.000 | 1, 3 | \n | Relés, Supresor Ruido, Mandos | 3 | 5.000 | 1, 3 | \n | Arnes / Bocina / Puerto USB | 3 | 5.000 | 1, 3 | \n | LCD Velocímetro | 12 | 20.000 | 1, 2, 3 | \n | Escobillas Motor arranque | 3 | 5.000 | 1, 3 | \n | Farola / Stop Led | 3 | 5.000 | 1, 3 | \n | Batería | 6 | 6.000 | 1, 3 | \n | CDI / ECU | 6 | 10.000 | 1, 3 | \n | Sensores / Actuadores / Bomba Combustible | 6 | 10.000 | 1, 3 | \n | Modulador ABS | 6 | 10.000 | 1, 3 | \n | Empaque Tapa Válvulas | 3 | 5.000 | 1 | \n | Empaques Cilindro / Culata | 3 | 5.000 | 1 | \n | Culata, Árbol de Levas | 12 | 20.000 | 1 | \n | Caja de Cambios | 12 | 20.000 | 1 | \n | Cilindro, Pistón, Cigueñal | 12 | 20.000 | 1 | \n | Rodamientos del Motor | 12 | 20.000 | 1 | \n | Filtro Combustible | 1 | 500 | 1 | \n | Filtro Aire | 1 | 500 | 1, 2 |\n\nCOMO CONDUCIR\nTU MOTOCICLETA\n\nTablas:\n\nCOMO CONDUCIR\nTU MOTOCICLETA\n\nTablas:\n\nBandas\n16 C C C R C C R C C R C C\nde Frenos\n17 Cunas Dirección C, A C, A C, A R C, A C, A R C, A C, A L C, A C, A Lubricar o Reemplazar\nsi es necesario.\n18 Bujes Soporte Motor C C C C C C C C C C C C Reemplazar si\nes necesario.\n19 Llantas C, A C, A C, A R C, A C, A R C, A C, A R C, A C, A Reemplazar si\nes necesario.\nA: Ajustar CL: Limpiar C: Chequear L: Lubricar T: Apretar R: Reemplazar\n.. 3322 ..']","¡Hola!

En la documentación de la Bajaj Boxer CT100 KS no se especifica el procedimiento para cambiar un fusible.",El manual no describe el procedimiento para cambio de fusibles.,0.5,0.0,
que herramientas trae la moto,"['Aceite de Motor\n• p. 56\n• ¿Cómo Conducir tu Motocicleta? p. 24\n• p. 57\n• P. 26\n• p. 58\n• p. 30\n• p. 58\n• Almacenamiento de la Motocicleta ............................................ p. 34\n\nveces para cubrir la pared del cilindro con el\naceite e instalar de nuevo la bujía. A. Retire la batería y colóquela\n5. Coloque la motocicleta en una plataforma en una zona bien ventilada.\nde modo que las ruedas no toquen el suelo. B. Antes de volver a usar la moto:\nno pintadas para prevenir la oxidación. • Lleve la batería a recargar .\n7. Lubrique los cables de control. • Aplique vaselina en los terminales de la batería\n8. Cubra la moto perfectamente. (aplica solo a determinados modelos).\n9. Asegúrese de que el área de almacenamiento\nesté bien ventilada y libre de cualquier fuente\nde llamas o chispas.\n10. Agregue 10% más de aire a las llantas.\n. 35 .\n\n• Salga temprano para llegar a su destino pastillas de freno.\nde manera segura. • Revise la tensión de la cadena de 20 a 30 mm y\n• Lleve siempre los documentos de la motocicleta que esté bien lubricada.\nvigentes y una licencia válida de conducción. • Funcionamiento de todas las luces y bocina.\n• Evite manejar sobre arena suelta o piedras, • Movimiento suave de la dirección sin restricciones.\ndonde el vehículo podría patinar. • Juego libre en la palanca de embrague de 2 a 3 mm.\n• Sujete adecuadamente la ropa suelta mientras • Regreso del estante central y lateral.\nconduce o monta para evitar enredos u otros • Presión de inflado correcta en las dos llantas - sin\nobjetos en las ruedas. grietas/ cortes.\n• Concéntrese siempre en un manejo seguro. • Correcta fijación y posición de los espejos.\n. 28 .\n\nveces para cubrir la pared del cilindro con el\naceite e instalar de nuevo la bujía. A.Retire la batería y colóquela\n5. Coloque la motocicleta en una plataforma en una zona bien ventilada.\nde modo que las ruedas no toquen el suelo. B. Antes de volver a usar la moto:\n6. Ponga aceite en todas las superficies metálicas\nno pintadas para prevenir la oxidación. • Lleve la batería a recargar .\n7. Lubrique los cables de control. • Aplique vaselina en los terminales de la batería\n8. Cubra la moto perfectamente. (aplica solo a determinados modelos).\n9. Asegúrese de que el área de almacenamiento\nesté bien ventilada y libre de cualquier fuente\nde llamas o chispas.\n10. Agregue 10% más de aire a las llantas.\n. 35 .\n\nde manera segura. • Revise la tensión de la cadena de 20 a 30 mm y\n• Lleve siempre los documentos de la motocicleta que esté bien lubricada.\nvigentes y una licencia válida de conducción. • Funcionamiento de todas las luces y bocina.\n• Evite manejar sobre arena suelta o piedras, • Movimiento suave de la dirección sin restricciones.\ndonde el vehículo podría patinar. • Juego libre en la palanca de embrague de 2 a 3 mm.\n• Sujete adecuadamente la ropa suelta mientras • Regreso del estante central y lateral.\nconduce o monta para evitar enredos u otros\nobjetos en las ruedas. grietas/ cortes.\n• Concéntrese siempre en un manejo seguro. de los espejos.\n. 28 .']","¡Hola!

En la documentación de la Bajaj Boxer CT100 KS no se especifica qué herramientas trae la moto.",Trae un kit básico de herramientas ubicado junto a la batería.,,0.0,0.0
que tipo de encendido tiene la moto,"['dirección hacia la derecha o izquierda.\nF. Interruptor de encendido: Al girar la llave\nse activa o desactiva el sistema eléctrico\nLa llave de la motocicleta funciona para el interruptor de encendido, tapa del\ny encendido y se bloquea la direccion.\ntanque de combustible y cierre de la cubierta lateral izquierda.\nG. Odómetro: Muestra la distancia total recorrida.\n. 15 .\n\ndirección hacia la derecha o izquierda.\nF. Interruptor de Encendido: Al girar la llave\nse activa o desactiva el sistema eléctrico\nLa llave de la motocicleta funciona para el interruptor de encendido, tapa del\ny encendido y se bloquea la direccion.\nG. Odómetro: Muestra la distancia total recorrida. tanque de combustible y cierre de la cubierta lateral izquierda.\n. 15 .\n\n¿Cómo Conducir tu Motocicleta?\nEncendido del motor: Arranque:\n1. Coloque la llave de gasolina en ON o RES. • Confirme que el estante lateral y central están arriba.\n2. Coloque el interruptor de encendido en posición • Oprima la palanca del embrague.\nON usando la llave de la motocicleta. • Engrane la primera marcha (1a Vel).\n3. Confirme que la transmisión esta en neutral. • Gire levemente el acelerador mientras\n4. Use el ahogador durante el primer encendido o libera simultáneamente el embrague.\ndurante las mañanas frías. La palanca del ahogador • Mientras libera la palanca del embrague abra el acelerador,\n/choke se localiza en la parte izquierda del carburador. solo para alcanzar las r.p.m necesarias para mover la moto.\n5. Mantenga el acelerador cerrado, accione\nel pedal de arranque con el pie. Cambio de marchas:\n6. Cuando el motor se haya calentado lo suficiente, • Libere el acelerador y oprima la palanca del embrague\n\n¿Cómo Conducir tu Motocicleta?\nEncendido del motor: Arranque:\n1. Coloque la llave de gasolina en ON o RES.\n2. Coloque el interruptor de encendido en posición • Oprima la palanca del embrague.\nON usando la llave de la motocicleta. • Engrane la primera marcha (1a Vel).\n• Gire levemente el acelerador mientras\n4. Use el ahogador durante el primer encendido o\ndurante las mañanas frías. La palanca del ahogador • Mientras libera la palanca del embrague abra el acelerador,\n/choke se localiza en la parte izquierda del carburador. solo para alcanzar las r.p.m necesarias para mover la moto.\n5. Mantenga el acelerador cerrado, accione\nel pedal de arranque con el pie. Cambio de marchas:\n• Libere el acelerador y oprima la palanca del embrague\ncierre la palanca del ahogador/choke. • Embrague la marcha superior o inferior.\nAbra el acelerador mientras libera la palanca de embrague\nVelocidades recomendadas\npara bajar el cambio/marcha\nN\n1 de 4a a 3ra 35 Km/h\n2\nde 3ra a 2da 25 Km/h\n3\n\nTablero de Instrumentos e Interruptor de Encendido\nA B C E D\nG\nF\nSistema Eléctrico /\nPosición Función\nLLave\nA. Velocímetro: La aguja indica la\nBloquea el giro de la\nvelocidad a la que se está conduciendo.\ndirección hacia el lado\nB. Puerto de carga USB: Sólo utilizarlo LOCK LOCK (Seguro) Desconectado/ derecho o izquierdo,\ncuando el motor esté encendido. Puede retirar la llave recomendado para\nC. Indicador de neutral: Se ilumina cuando la transmisión estacionar la motocicleta.\nestá en posición neutral y la llave en posición ON.\nD. Indicador de luz alta: Se ilumina cuando Desconectado/\nOFF (Apagado) Detiene el giro del motor.\nse acciona el interruptor de luz alta. Puede retirar la llave\nE. Indicador de direccionales: Se ilumina\nConectado/ Activa sistema eléctrico y\ncuando se acciona el interruptor de cambio de ON (Encendido)\nNo Puede retirar la llave puede encender el motor.\ndirección hacia la derecha o izquierda.\nF. Interruptor de Encendido: Al girar la llave']","Hola!

Según la información que tengo, la Bajaj Boxer CT100 KS tiene un **interruptor de encendido** que activa o desactiva el sistema eléctrico y el encendido al girar la llave. La llave también sirve para bloquear la dirección y abrir la tapa del tanque de combustible y la cubierta lateral izquierda.

Espero que esta información te sea útil!",tiene encendido por pedal.,0.6666666666666666,0.12017902107073462,0.0
